"","id","itemTime","name","type","question","relevance","competence","prior","condition","answer","RT","language","comments","engagement","difficulty","time"
"934","A1S6C6EN8MPKC3:3D3VGR7TA1NQKWR2N0D5PZW46I5R3T",1445969629944,"Tony's clubbing","lhl","Rob knows whether they play both Jazz and Metal at the club tonight.",0,1,0,"comp",0,15424,"english",NA,10,7,332328
"935","A1S6C6EN8MPKC3:3D3VGR7TA1NQKWR2N0D5PZW46I5R3T",1445969653456,"Joshua's delay","llh","Kevin and Cory expected Joshua to arrive earlier.",0,0,1,"test_true",0.25,23511,"english",NA,10,7,332328
"936","A1S6C6EN8MPKC3:3D3VGR7TA1NQKWR2N0D5PZW46I5R3T",1445969667951,"Joshua's delay","llh","From what Cory said we may conclude that Joshua did not have to both eat lunch and do his homework.",0,0,1,"xor",0.81,14494,"english",NA,10,7,332328
"937","A1U2V3827PFUEB:3JZQSN0I3RIUBIYHRKKVR47U7ZZGFV",1445967374655,"Leo's wife","hll","Leo is an avid golf player.",1,0,0,"test_uncertain",0.87,20177,"English","no",10,2,219162
"938","A1U2V3827PFUEB:3JZQSN0I3RIUBIYHRKKVR47U7ZZGFV",1445967390966,"Leo's wife","hll","Hans knows whether someone just made a hole-in-one on both the first and the second hole.",1,0,0,"comp",0.57,16310,"English","no",10,2,219162
"939","A1U2V3827PFUEB:3JZQSN0I3RIUBIYHRKKVR47U7ZZGFV",1445967411063,"Harold's pet","lll","Harold's girlfriend gave in because Harold kept nagging her about wanting a pet.",0,0,0,"test_uncertain",0.53,20096,"English","no",10,2,219162
"940","A1U2V3827PFUEB:3JZQSN0I3RIUBIYHRKKVR47U7ZZGFV",1445967421008,"Harold's pet","lll","From what Richard said we may conclude that Harold did not buy both a cat and a dog.",0,0,0,"xor",0.71,9944,"English","no",10,2,219162
"941","A1U2V3827PFUEB:3JZQSN0I3RIUBIYHRKKVR47U7ZZGFV",1445967436104,"Pete's accident","hhl","Pete was injured while playing in the garden.",1,1,0,"test_false",0.88,15096,"English","no",10,2,219162
"942","A1U2V3827PFUEB:3JZQSN0I3RIUBIYHRKKVR47U7ZZGFV",1445967444497,"Pete's accident","hhl","If Pete broke his arm, it is likely that he also broke his leg.",1,1,0,"prior",0.13,8392,"English","no",10,2,219162
"943","A1U2V3827PFUEB:3JZQSN0I3RIUBIYHRKKVR47U7ZZGFV",1445967455546,"Pete's accident","hhl","If Pete broke his leg, it is likely that he also broke his arm.",1,1,0,"prior",0.11,11047,"English","no",10,2,219162
"944","A1U2V3827PFUEB:3JZQSN0I3RIUBIYHRKKVR47U7ZZGFV",1445967475123,"Mrs Gibbs' worry","hhh","Mrs Gibbs did not accompany her husband when Cindy served him.",1,1,1,"test_true",0.99,19576,"English","no",10,2,219162
"945","A1U2V3827PFUEB:3JZQSN0I3RIUBIYHRKKVR47U7ZZGFV",1445967483027,"Mrs Gibbs' worry","hhh","From what Cindy said we may conclude that Mr Gibbs did not have both a steak and a beer.",1,1,1,"xor",0.52,7904,"English","no",10,2,219162
"946","A1U2V3827PFUEB:3JZQSN0I3RIUBIYHRKKVR47U7ZZGFV",1445967508788,"Joshua's delay","llh","Kevin and Cory expected Joshua to arrive earlier.",0,0,1,"test_true",0.77,25760,"English","no",10,2,219162
"947","A1U2V3827PFUEB:3JZQSN0I3RIUBIYHRKKVR47U7ZZGFV",1445967515477,"Joshua's delay","llh","It is important for Kevin to know whether Joshua had to both eat lunch and do his homework.",0,0,1,"rel",0.09,6688,"English","no",10,2,219162
"948","A1U2V3827PFUEB:3JZQSN0I3RIUBIYHRKKVR47U7ZZGFV",1445967532606,"Gigi's exams","hlh","Gigi hired a private tutor to help her with her Biology and Chemistry exams.",1,0,1,"test_false",1,17128,"English","no",10,2,219162
"949","A1U2V3827PFUEB:3JZQSN0I3RIUBIYHRKKVR47U7ZZGFV",1445967537326,"Gigi's exams","hlh","If Gigi passed her Chemistry exam, it is likely that she also passed her Physics exam.",1,0,1,"prior",0.77,4720,"English","no",10,2,219162
"950","A1U2V3827PFUEB:3JZQSN0I3RIUBIYHRKKVR47U7ZZGFV",1445967542054,"Gigi's exams","hlh","If Gigi passed her Physics exam, it is likely that she also passed her Chemistry exam.",1,0,1,"prior",0.82,4727,"English","no",10,2,219162
"951","A1U2V3827PFUEB:3JZQSN0I3RIUBIYHRKKVR47U7ZZGFV",1445967562823,"Tony's clubbing","lhl","Techno is quite different from Jazz and from Metal.",0,1,0,"test_true",0.95,20768,"English","no",10,2,219162
"952","A1U2V3827PFUEB:3JZQSN0I3RIUBIYHRKKVR47U7ZZGFV",1445967568679,"Tony's clubbing","lhl","It is important for Tony to know whether they play both Jazz and Metal tonight.",0,1,0,"rel",0.99,5855,"English","no",10,2,219162
"953","A1U2V3827PFUEB:3JZQSN0I3RIUBIYHRKKVR47U7ZZGFV",1445967583528,"Bill's order","lhh","Jake and Bill spent a lot of time together that day.",0,1,1,"test_true",0.73,14848,"English","no",10,2,219162
"954","A1U2V3827PFUEB:3JZQSN0I3RIUBIYHRKKVR47U7ZZGFV",1445967593817,"Bill's order","lhh","Jake knows whether Bill ordered both a starter and a side dish.",0,1,1,"comp",0.61,10288,"English","no",10,2,219162
"955","A1U51UH6XVUVLS:34MAJL3QP5VJJQP4COHSH6LUE4L34M",1445967540210,"Carl's party","hll","Carl's wife liked the music very much.",1,0,0,"test_uncertain",0.47,28169,"English",NA,9,3,202849
"956","A1U51UH6XVUVLS:34MAJL3QP5VJJQP4COHSH6LUE4L34M",1445967548082,"Carl's party","hll","If Carl danced passionately with Sue, it is likely that he also danced passionately with Mary.",1,0,0,"prior",0.66,7872,"English",NA,9,3,202849
"957","A1U51UH6XVUVLS:34MAJL3QP5VJJQP4COHSH6LUE4L34M",1445967554684,"Carl's party","hll","If Carl danced passionately with Mary, it is likely that he also danced passionately with Sue.",1,0,0,"prior",0.69,6602,"English",NA,9,3,202849
"958","A1U51UH6XVUVLS:34MAJL3QP5VJJQP4COHSH6LUE4L34M",1445967574686,"Brad's clothes","hlh","Mandy feels attracted to Brad.",1,0,1,"test_uncertain",0.36,20001,"English",NA,9,3,202849
"959","A1U51UH6XVUVLS:34MAJL3QP5VJJQP4COHSH6LUE4L34M",1445967590544,"Brad's clothes","hlh","It is important for Mandy to know whether Brad bought both a sweater and a pair of jeans.",1,0,1,"rel",0.27,15857,"English",NA,9,3,202849
"960","A1U51UH6XVUVLS:34MAJL3QP5VJJQP4COHSH6LUE4L34M",1445967607035,"Joshua's delay","llh","Kevin, Cory and Joshua do not like to hang out with girls.",0,0,1,"test_uncertain",0.01,16490,"English",NA,9,3,202849
"961","A1U51UH6XVUVLS:34MAJL3QP5VJJQP4COHSH6LUE4L34M",1445967615619,"Joshua's delay","llh","Cory knows whether Joshua had to both eat lunch and do his homework.",0,0,1,"comp",0.18,8584,"English",NA,9,3,202849
"962","A1U51UH6XVUVLS:34MAJL3QP5VJJQP4COHSH6LUE4L34M",1445967629837,"Lily's husband","lhl","Eric has a problem with his liver for which he has to stop drinking alcohol.",0,1,0,"test_uncertain",0.98,14216,"English",NA,9,3,202849
"963","A1U51UH6XVUVLS:34MAJL3QP5VJJQP4COHSH6LUE4L34M",1445967634766,"Lily's husband","lhl","If Eric drank whisky, it is likely that he drank vodka as well.",0,1,0,"prior",0.95,4929,"English",NA,9,3,202849
"964","A1U51UH6XVUVLS:34MAJL3QP5VJJQP4COHSH6LUE4L34M",1445967637515,"Lily's husband","lhl","If Eric drank vodka, it is likely that he drank whisky as well.",0,1,0,"prior",0.89,2748,"English",NA,9,3,202849
"965","A1U51UH6XVUVLS:34MAJL3QP5VJJQP4COHSH6LUE4L34M",1445967663796,"Mrs Gibbs' worry","hhh","Mrs Gibbs is worried about Cindy's health.",1,1,1,"test_false",0,26280,"English",NA,9,3,202849
"966","A1U51UH6XVUVLS:34MAJL3QP5VJJQP4COHSH6LUE4L34M",1445967669621,"Mrs Gibbs' worry","hhh","It is important for Mrs Gibbs to know whether Mr Gibbs had both a steak and a beer.",1,1,1,"rel",0.89,5824,"English",NA,9,3,202849
"967","A1U51UH6XVUVLS:34MAJL3QP5VJJQP4COHSH6LUE4L34M",1445967684496,"Harold's pet","lll","Harold's girlfriend didn't want a pet in her house before.",0,0,0,"test_true",0.85,14874,"English",NA,9,3,202849
"968","A1U51UH6XVUVLS:34MAJL3QP5VJJQP4COHSH6LUE4L34M",1445967694702,"Harold's pet","lll","From what Richard said we may conclude that Harold did not buy both a cat and a dog.",0,0,0,"xor",0.81,10205,"English",NA,9,3,202849
"969","A1U51UH6XVUVLS:34MAJL3QP5VJJQP4COHSH6LUE4L34M",1445967713447,"Pete's accident","hhl","Pete's teacher saw him fall off the slide.",1,1,0,"test_uncertain",0.76,18744,"English",NA,9,3,202849
"970","A1U51UH6XVUVLS:34MAJL3QP5VJJQP4COHSH6LUE4L34M",1445967721728,"Pete's accident","hhl","The teacher knows whether Pete broke both his arm and his leg.",1,1,0,"comp",0.07,8280,"English",NA,9,3,202849
"971","A1U51UH6XVUVLS:34MAJL3QP5VJJQP4COHSH6LUE4L34M",1445967734716,"Bill's order","lhh","Jake and Bill spent a lot of time together that day.",0,1,1,"test_true",0.6,12987,"English",NA,9,3,202849
"972","A1U51UH6XVUVLS:34MAJL3QP5VJJQP4COHSH6LUE4L34M",1445967743059,"Bill's order","lhh","From what Jake said we may conclude that Bill did not order both a starter and a side dish.",0,1,1,"xor",0.82,8343,"English",NA,9,3,202849
"973","A1VZSFHTU51JP0:3ZPPDN2SLW4NQUBDI3UFH507RLQE9L",1445971661719,"Harold's pet","lll","Harold is single.",0,0,0,"test_false",0,30952,"English",NA,10,4,366135
"974","A1VZSFHTU51JP0:3ZPPDN2SLW4NQUBDI3UFH507RLQE9L",1445971676990,"Harold's pet","lll","From what Richard said we may conclude that Harold did not buy both a cat and a dog.",0,0,0,"xor",1,15269,"English",NA,10,4,366135
"975","A1VZSFHTU51JP0:3ZPPDN2SLW4NQUBDI3UFH507RLQE9L",1445971705269,"Chloe's holiday","lhh","Chloe recently got back from holidays.",0,1,1,"test_true",1,28279,"English",NA,10,4,366135
"976","A1VZSFHTU51JP0:3ZPPDN2SLW4NQUBDI3UFH507RLQE9L",1445971722645,"Chloe's holiday","lhh","If Susan brought some extra suntan lotion, it is likely that Amelia brought some as well.",0,1,1,"prior",0.36,17375,"English",NA,10,4,366135
"977","A1VZSFHTU51JP0:3ZPPDN2SLW4NQUBDI3UFH507RLQE9L",1445971736998,"Chloe's holiday","lhh","If Amelia brought some extra suntan lotion, it is likely that Susan brought some as well.",0,1,1,"prior",0.33,14352,"English",NA,10,4,366135
"978","A1VZSFHTU51JP0:3ZPPDN2SLW4NQUBDI3UFH507RLQE9L",1445971802629,"Carl's party","hll","John and Carl, the hosts, are a gay couple.",1,0,0,"test_false",0,65630,"English",NA,10,4,366135
"979","A1VZSFHTU51JP0:3ZPPDN2SLW4NQUBDI3UFH507RLQE9L",1445971820181,"Carl's party","hll","It is important for Carl's wife to know whether Carl danced passionately with both Sue and Mary.",1,0,0,"rel",1,17551,"English",NA,10,4,366135
"980","A1VZSFHTU51JP0:3ZPPDN2SLW4NQUBDI3UFH507RLQE9L",1445971845453,"Brad's clothes","hlh","Brad is not happy about the fact that his friends make jokes about his shabby clothes.",1,0,1,"test_true",0.72,25271,"English",NA,10,4,366135
"981","A1VZSFHTU51JP0:3ZPPDN2SLW4NQUBDI3UFH507RLQE9L",1445971867798,"Brad's clothes","hlh","Gina knows whether Brad bought both a sweater and a pair of jeans.",1,0,1,"comp",0.63,22345,"English",NA,10,4,366135
"982","A1VZSFHTU51JP0:3ZPPDN2SLW4NQUBDI3UFH507RLQE9L",1445971887173,"Mrs Gibbs' worry","hhh","Mrs Gibbs is worried about Cindy's health.",1,1,1,"test_false",0.2,19375,"English",NA,10,4,366135
"983","A1VZSFHTU51JP0:3ZPPDN2SLW4NQUBDI3UFH507RLQE9L",1445971895701,"Mrs Gibbs' worry","hhh","If Mr Gibbs had a steak, it is likely that he also had a beer.",1,1,1,"prior",0.5,8528,"English",NA,10,4,366135
"984","A1VZSFHTU51JP0:3ZPPDN2SLW4NQUBDI3UFH507RLQE9L",1445971901085,"Mrs Gibbs' worry","hhh","If Mr Gibbs had a beer, it is likely that he also had a steak.",1,1,1,"prior",0.5,5383,"English",NA,10,4,366135
"985","A1VZSFHTU51JP0:3ZPPDN2SLW4NQUBDI3UFH507RLQE9L",1445971927614,"Tony's clubbing","lhl","Rob is a big fan of Techno music as well.",0,1,0,"test_uncertain",0.63,26528,"English",NA,10,4,366135
"986","A1VZSFHTU51JP0:3ZPPDN2SLW4NQUBDI3UFH507RLQE9L",1445971933645,"Tony's clubbing","lhl","Rob knows whether they play both Jazz and Metal at the club tonight.",0,1,0,"comp",1,6031,"English",NA,10,4,366135
"987","A1VZSFHTU51JP0:3ZPPDN2SLW4NQUBDI3UFH507RLQE9L",1445971957149,"Pete's accident","hhl","Pete's teacher saw him fall off the slide.",1,1,0,"test_uncertain",0.61,23503,"English",NA,10,4,366135
"988","A1VZSFHTU51JP0:3ZPPDN2SLW4NQUBDI3UFH507RLQE9L",1445971967670,"Pete's accident","hhl","From what Pete's teacher said we may conclude that Pete did not break both his arm and his leg.",1,1,0,"xor",0.96,10519,"English",NA,10,4,366135
"989","A1VZSFHTU51JP0:3ZPPDN2SLW4NQUBDI3UFH507RLQE9L",1445971999726,"Joshua's delay","llh","Kevin and Cory expected Joshua to arrive earlier.",0,0,1,"test_true",1,32056,"English",NA,10,4,366135
"990","A1VZSFHTU51JP0:3ZPPDN2SLW4NQUBDI3UFH507RLQE9L",1445972027854,"Joshua's delay","llh","It is important for Kevin to know whether Joshua had to both eat lunch and do his homework.",0,0,1,"rel",0.21,28128,"English",NA,10,4,366135
"991","A1ZN0LUUOVLMJK:31LVTDXBL8I700HRT6H5LLQL64WLR1",1445967456327,"Jimmy's trip","lll","Jimmy had told his friends about his plans to visit New York City before.",0,0,0,"test_uncertain",0.2,35762,"english",NA,3,7,259746
"992","A1ZN0LUUOVLMJK:31LVTDXBL8I700HRT6H5LLQL64WLR1",1445967471128,"Jimmy's trip","lll","From what the brother said we may conclude that Jimmy did not visit both the Statue of Liberty and the Empire State Building.",0,0,0,"xor",0.82,14798,"english",NA,3,7,259746
"993","A1ZN0LUUOVLMJK:31LVTDXBL8I700HRT6H5LLQL64WLR1",1445967491744,"Brad's clothes","hlh","Mandy feels attracted to Brad.",1,0,1,"test_uncertain",0.63,20615,"english",NA,3,7,259746
"994","A1ZN0LUUOVLMJK:31LVTDXBL8I700HRT6H5LLQL64WLR1",1445967499486,"Brad's clothes","hlh","Gina knows whether Brad bought both a sweater and a pair of jeans.",1,0,1,"comp",0.07,7741,"english",NA,3,7,259746
"995","A1ZN0LUUOVLMJK:31LVTDXBL8I700HRT6H5LLQL64WLR1",1445967525820,"Danny's racket","hhh","Danny and Alex have known each other since high school.",1,1,1,"test_uncertain",0.68,26333,"english",NA,3,7,259746
"996","A1ZN0LUUOVLMJK:31LVTDXBL8I700HRT6H5LLQL64WLR1",1445967532115,"Danny's racket","hhh","It is important for Danny to know whether Alex bought both a racket and a pair of shoes.",1,1,1,"rel",0.97,6293,"english",NA,3,7,259746
"997","A1ZN0LUUOVLMJK:31LVTDXBL8I700HRT6H5LLQL64WLR1",1445967546490,"Chloe's holiday","lhh","Chloe recently got back from holidays.",0,1,1,"test_true",0.15,14374,"english",NA,3,7,259746
"998","A1ZN0LUUOVLMJK:31LVTDXBL8I700HRT6H5LLQL64WLR1",1445967557969,"Chloe's holiday","lhh","If Susan brought some extra suntan lotion, it is likely that Amelia brought some as well.",0,1,1,"prior",0.25,11478,"english",NA,3,7,259746
"999","A1ZN0LUUOVLMJK:31LVTDXBL8I700HRT6H5LLQL64WLR1",1445967563299,"Chloe's holiday","lhh","If Amelia brought some extra suntan lotion, it is likely that Susan brought some as well.",0,1,1,"prior",0.21,5329,"english",NA,3,7,259746
"1000","A1ZN0LUUOVLMJK:31LVTDXBL8I700HRT6H5LLQL64WLR1",1445967586188,"Lily's husband","lhl","Eric and Lily went to a bar together last night.",0,1,0,"test_false",0.02,22889,"english",NA,3,7,259746
"1001","A1ZN0LUUOVLMJK:31LVTDXBL8I700HRT6H5LLQL64WLR1",1445967594918,"Lily's husband","lhl","From what Bill said we may conclude that Eric did not drink both whisky and vodka.",0,1,0,"xor",0.15,8729,"english",NA,3,7,259746
"1002","A1ZN0LUUOVLMJK:31LVTDXBL8I700HRT6H5LLQL64WLR1",1445967634984,"Carl's party","hll","John and Carl, the hosts, are a gay couple.",1,0,0,"test_false",0,40065,"english",NA,3,7,259746
"1003","A1ZN0LUUOVLMJK:31LVTDXBL8I700HRT6H5LLQL64WLR1",1445967644863,"Carl's party","hll","If Carl danced passionately with Sue, it is likely that he also danced passionately with Mary.",1,0,0,"prior",0.12,9878,"english",NA,3,7,259746
"1004","A1ZN0LUUOVLMJK:31LVTDXBL8I700HRT6H5LLQL64WLR1",1445967648642,"Carl's party","hll","If Carl danced passionately with Mary, it is likely that he also danced passionately with Sue.",1,0,0,"prior",0.08,3778,"english",NA,3,7,259746
"1005","A1ZN0LUUOVLMJK:31LVTDXBL8I700HRT6H5LLQL64WLR1",1445967676134,"Mrs Sanders' son","hhl","The teacher is trying to find out who queued up twice.",1,1,0,"test_true",0.86,27491,"english",NA,3,7,259746
"1006","A1ZN0LUUOVLMJK:31LVTDXBL8I700HRT6H5LLQL64WLR1",1445967681698,"Mrs Sanders' son","hhl","Mrs Sanders knows whether Ted had both pizza and pasta.",1,1,0,"comp",0.11,5563,"english",NA,3,7,259746
"1007","A1ZN0LUUOVLMJK:31LVTDXBL8I700HRT6H5LLQL64WLR1",1445967710046,"Joshua's delay","llh","Kevin, Cory and Joshua are brothers.",0,0,1,"test_false",0,28346,"english",NA,3,7,259746
"1008","A1ZN0LUUOVLMJK:31LVTDXBL8I700HRT6H5LLQL64WLR1",1445967716073,"Joshua's delay","llh","It is important for Kevin to know whether Joshua had to both eat lunch and do his homework.",0,0,1,"rel",0.63,6027,"english",NA,3,7,259746
"1009","A1ZYF4MBFRMCE1:35BLDD71I75JYWFCHRDOUXQM6JHVZN",1445967320793,"Brad's clothes","hlh","Gina and Mandy accompanied Brad on his shopping trip.",1,0,1,"test_false",0.07,12493,"English","None.",9,0,217704
"1010","A1ZYF4MBFRMCE1:35BLDD71I75JYWFCHRDOUXQM6JHVZN",1445967328507,"Brad's clothes","hlh","If Brad bought a pair of jeans, it is likely that he also bought a sweater.",1,0,1,"prior",0.66,7712,"English","None.",9,0,217704
"1011","A1ZYF4MBFRMCE1:35BLDD71I75JYWFCHRDOUXQM6JHVZN",1445967333888,"Brad's clothes","hlh","If Brad bought a sweater, it is likely that he also bought a pair of jeans.",1,0,1,"prior",0.72,5380,"English","None.",9,0,217704
"1012","A1ZYF4MBFRMCE1:35BLDD71I75JYWFCHRDOUXQM6JHVZN",1445967358166,"Carl's party","hll","John and Carl, the hosts, are a gay couple.",1,0,0,"test_false",0.56,24276,"English","None.",9,0,217704
"1013","A1ZYF4MBFRMCE1:35BLDD71I75JYWFCHRDOUXQM6JHVZN",1445967365158,"Carl's party","hll","John knows whether Carl danced passionately with both Sue and Mary.",1,0,0,"comp",0.83,6991,"English","None.",9,0,217704
"1014","A1ZYF4MBFRMCE1:35BLDD71I75JYWFCHRDOUXQM6JHVZN",1445967374065,"Chloe's holiday","lhh","Chloe recently got back from holidays.",0,1,1,"test_true",0.96,8905,"English","None.",9,0,217704
"1015","A1ZYF4MBFRMCE1:35BLDD71I75JYWFCHRDOUXQM6JHVZN",1445967379392,"Chloe's holiday","lhh","If Amelia brought some extra suntan lotion, it is likely that Susan brought some as well.",0,1,1,"prior",0.5,5325,"English","None.",9,0,217704
"1016","A1ZYF4MBFRMCE1:35BLDD71I75JYWFCHRDOUXQM6JHVZN",1445967387200,"Chloe's holiday","lhh","If Susan brought some extra suntan lotion, it is likely that Amelia brought some as well.",0,1,1,"prior",0.53,7807,"English","None.",9,0,217704
"1017","A1ZYF4MBFRMCE1:35BLDD71I75JYWFCHRDOUXQM6JHVZN",1445967402660,"Pete's accident","hhl","Pete was injured while playing in the garden.",1,1,0,"test_false",0.83,15458,"English","None.",9,0,217704
"1018","A1ZYF4MBFRMCE1:35BLDD71I75JYWFCHRDOUXQM6JHVZN",1445967408787,"Pete's accident","hhl","It is important for Pete's mother to know whether Pete broke both his arm and his leg.",1,1,0,"rel",1,6126,"English","None.",9,0,217704
"1019","A1ZYF4MBFRMCE1:35BLDD71I75JYWFCHRDOUXQM6JHVZN",1445967430719,"Joshua's delay","llh","Kevin and Cory expected Joshua to arrive earlier.",0,0,1,"test_true",1,21931,"English","None.",9,0,217704
"1020","A1ZYF4MBFRMCE1:35BLDD71I75JYWFCHRDOUXQM6JHVZN",1445967438575,"Joshua's delay","llh","From what Cory said we may conclude that Joshua did not have to both eat lunch and do his homework.",0,0,1,"xor",0.08,7855,"English","None.",9,0,217704
"1021","A1ZYF4MBFRMCE1:35BLDD71I75JYWFCHRDOUXQM6JHVZN",1445967463968,"Jimmy's trip","lll","Jimmy had told his friends about his plans to visit New York City before.",0,0,0,"test_uncertain",0.11,25392,"English","None.",9,0,217704
"1022","A1ZYF4MBFRMCE1:35BLDD71I75JYWFCHRDOUXQM6JHVZN",1445967472982,"Jimmy's trip","lll","Jimmy's brother knows whether Jimmy visited both the Statue of Liberty and the Empire State Building.",0,0,0,"comp",0.79,9013,"English","None.",9,0,217704
"1023","A1ZYF4MBFRMCE1:35BLDD71I75JYWFCHRDOUXQM6JHVZN",1445967498437,"Tony's clubbing","lhl","Techno is quite different from Jazz and from Metal.",0,1,0,"test_true",1,25454,"English","None.",9,0,217704
"1024","A1ZYF4MBFRMCE1:35BLDD71I75JYWFCHRDOUXQM6JHVZN",1445967503367,"Tony's clubbing","lhl","From what Rob said we may conclude that they do not play both Jazz and Metal tonight.",0,1,0,"xor",0.36,4929,"English","None.",9,0,217704
"1025","A1ZYF4MBFRMCE1:35BLDD71I75JYWFCHRDOUXQM6JHVZN",1445967534329,"Danny's racket","hhh","Danny and Alex went to the sports store together.",1,1,1,"test_false",0.46,30961,"English","None.",9,0,217704
"1026","A1ZYF4MBFRMCE1:35BLDD71I75JYWFCHRDOUXQM6JHVZN",1445967538497,"Danny's racket","hhh","It is important for Danny to know whether Alex bought both a racket and a pair of shoes.",1,1,1,"rel",0.73,4166,"English","None.",9,0,217704
"1027","A20ALQT1HIVSAH:3UN61F00HXXTYBE61J1Y4WUOKCZR5I",1445876205713,"Mrs Gibbs' worry","hhh","Cindy is secretly in love with Mrs Gibbs' husband.",1,1,1,"test_uncertain",0,13027,"English",NA,5,0,172559
"1028","A20ALQT1HIVSAH:3UN61F00HXXTYBE61J1Y4WUOKCZR5I",1445876211529,"Mrs Gibbs' worry","hhh","It is important for Mrs Gibbs to know whether Mr Gibbs had both a steak and a beer.",1,1,1,"rel",0.95,5816,"English",NA,5,0,172559
"1029","A20ALQT1HIVSAH:3UN61F00HXXTYBE61J1Y4WUOKCZR5I",1445876226359,"Pete's accident","hhl","Pete's teacher saw him fall off the slide.",1,1,0,"test_uncertain",0.5,14829,"English",NA,5,0,172559
"1030","A20ALQT1HIVSAH:3UN61F00HXXTYBE61J1Y4WUOKCZR5I",1445876233259,"Pete's accident","hhl","The teacher knows whether Pete broke both his arm and his leg.",1,1,0,"comp",0,6899,"English",NA,5,0,172559
"1031","A20ALQT1HIVSAH:3UN61F00HXXTYBE61J1Y4WUOKCZR5I",1445876243575,"Chloe's holiday","lhh","Chloe went on holidays with a big group of her friends.",0,1,1,"test_false",0.4,10314,"English",NA,5,0,172559
"1032","A20ALQT1HIVSAH:3UN61F00HXXTYBE61J1Y4WUOKCZR5I",1445876247744,"Chloe's holiday","lhh","If Susan brought some extra suntan lotion, it is likely that Amelia brought some as well.",0,1,1,"prior",0.51,4168,"English",NA,5,0,172559
"1033","A20ALQT1HIVSAH:3UN61F00HXXTYBE61J1Y4WUOKCZR5I",1445876250919,"Chloe's holiday","lhh","If Amelia brought some extra suntan lotion, it is likely that Susan brought some as well.",0,1,1,"prior",0.5,3175,"English",NA,5,0,172559
"1034","A20ALQT1HIVSAH:3UN61F00HXXTYBE61J1Y4WUOKCZR5I",1445876267790,"Leo's wife","hll","Leo is sponsoring a tennis tournament.",1,0,0,"test_false",1,16870,"English",NA,5,0,172559
"1035","A20ALQT1HIVSAH:3UN61F00HXXTYBE61J1Y4WUOKCZR5I",1445876278425,"Leo's wife","hll","It is important for Leo to know whether someone made a hole-in-one on both the first and the second hole.",1,0,0,"rel",1,10634,"English",NA,5,0,172559
"1036","A20ALQT1HIVSAH:3UN61F00HXXTYBE61J1Y4WUOKCZR5I",1445876293085,"Brad's clothes","hlh","Mandy feels attracted to Brad.",1,0,1,"test_uncertain",0,14658,"English",NA,5,0,172559
"1037","A20ALQT1HIVSAH:3UN61F00HXXTYBE61J1Y4WUOKCZR5I",1445876301188,"Brad's clothes","hlh","From what Gina said we may conclude that Brad did not buy both a sweater and a pair of jeans.",1,0,1,"xor",0.91,8102,"English",NA,5,0,172559
"1038","A20ALQT1HIVSAH:3UN61F00HXXTYBE61J1Y4WUOKCZR5I",1445876310488,"Lily's husband","lhl","Eric and Lily went to a bar together last night.",0,1,0,"test_false",0,9300,"English",NA,5,0,172559
"1039","A20ALQT1HIVSAH:3UN61F00HXXTYBE61J1Y4WUOKCZR5I",1445876324200,"Lily's husband","lhl","If Eric drank whisky, it is likely that he drank vodka as well.",0,1,0,"prior",0,13712,"English",NA,5,0,172559
"1040","A20ALQT1HIVSAH:3UN61F00HXXTYBE61J1Y4WUOKCZR5I",1445876330322,"Lily's husband","lhl","If Eric drank vodka, it is likely that he drank whisky as well.",0,1,0,"prior",0,6121,"English",NA,5,0,172559
"1041","A20ALQT1HIVSAH:3UN61F00HXXTYBE61J1Y4WUOKCZR5I",1445876350704,"Jimmy's trip","lll","Jimmy had to rush to be back home and did not have much time to spend in the city.",0,0,0,"test_true",1,20382,"English",NA,5,0,172559
"1042","A20ALQT1HIVSAH:3UN61F00HXXTYBE61J1Y4WUOKCZR5I",1445876355776,"Jimmy's trip","lll","From what the brother said we may conclude that Jimmy did not visit both the Statue of Liberty and the Empire State Building.",0,0,0,"xor",1,5072,"English",NA,5,0,172559
"1043","A20ALQT1HIVSAH:3UN61F00HXXTYBE61J1Y4WUOKCZR5I",1445876374334,"Gerald's graduation","llh","Gerald is friends with both Nico and Rick.",0,0,1,"test_true",1,18557,"English",NA,5,0,172559
"1044","A20ALQT1HIVSAH:3UN61F00HXXTYBE61J1Y4WUOKCZR5I",1445876378272,"Gerald's graduation","llh","Nico knows whether both Gerald's mother and his father attended the ceremony.",0,0,1,"comp",0,3936,"English",NA,5,0,172559
"1045","A21SF3IKIZB0VN:34BBWHLWHBJAIVQ77XUYG46AHFHIWN",1445967351900,"Leo's wife","hll","Leo is sponsoring a tennis tournament.",1,0,0,"test_false",0,23667,"English","Everything was fine",10,2,391683
"1046","A21SF3IKIZB0VN:34BBWHLWHBJAIVQ77XUYG46AHFHIWN",1445967391768,"Leo's wife","hll","Hans knows whether someone just made a hole-in-one on both the first and the second hole.",1,0,0,"comp",0.58,39867,"English","Everything was fine",10,2,391683
"1047","A21SF3IKIZB0VN:34BBWHLWHBJAIVQ77XUYG46AHFHIWN",1445967417927,"Harold's pet","lll","Harold is single.",0,0,0,"test_false",1,26157,"English","Everything was fine",10,2,391683
"1048","A21SF3IKIZB0VN:34BBWHLWHBJAIVQ77XUYG46AHFHIWN",1445967432433,"Harold's pet","lll","If Harold bought a dog, it is likely that he bought a cat as well.",0,0,0,"prior",0.2,14505,"English","Everything was fine",10,2,391683
"1049","A21SF3IKIZB0VN:34BBWHLWHBJAIVQ77XUYG46AHFHIWN",1445967455707,"Harold's pet","lll","If Harold bought a cat, it is likely that he bought a dog as well.",0,0,0,"prior",0.28,23273,"English","Everything was fine",10,2,391683
"1050","A21SF3IKIZB0VN:34BBWHLWHBJAIVQ77XUYG46AHFHIWN",1445967480698,"Gerald's graduation","llh","Gerald took almost ten years to graduate.",0,0,1,"test_uncertain",0.38,24990,"English","Everything was fine",10,2,391683
"1051","A21SF3IKIZB0VN:34BBWHLWHBJAIVQ77XUYG46AHFHIWN",1445967505775,"Gerald's graduation","llh","From what Nico said we may conclude that Gerald's mother and his father did not both attend the ceremony.",0,0,1,"xor",0.95,25076,"English","Everything was fine",10,2,391683
"1052","A21SF3IKIZB0VN:34BBWHLWHBJAIVQ77XUYG46AHFHIWN",1445967552138,"Tony's clubbing","lhl","Tony has to work at club Macabre tonight.",0,1,0,"test_false",0.38,46362,"English","Everything was fine",10,2,391683
"1053","A21SF3IKIZB0VN:34BBWHLWHBJAIVQ77XUYG46AHFHIWN",1445967578876,"Tony's clubbing","lhl","It is important for Tony to know whether they play both Jazz and Metal tonight.",0,1,0,"rel",0.83,26737,"English","Everything was fine",10,2,391683
