"","id","itemTime","name","type","question","relevance","competence","prior","condition","answer","RT","language","comments","engagement","difficulty","time"
"2571","A3OSR3YW4IQRG4:3AUQQEL7U61MWB9MDX0WOYN0OCXV0U",1445967574884,"Danny's racket","hhh","Danny and Alex have known each other since high school.",1,1,1,"test_uncertain",0.48,24316,"English",NA,7,3,245552
"2572","A3OSR3YW4IQRG4:3AUQQEL7U61MWB9MDX0WOYN0OCXV0U",1445967581260,"Danny's racket","hhh","From what Alex's girlfriend said we may conclude that Alex did not buy both a racket and a pair of shoes.",1,1,1,"xor",0.74,6372,"English",NA,7,3,245552
"2573","A3OSR3YW4IQRG4:3AUQQEL7U61MWB9MDX0WOYN0OCXV0U",1445967592025,"Gerald's graduation","llh","Gerald took almost ten years to graduate.",0,0,1,"test_uncertain",0.03,10760,"English",NA,7,3,245552
"2574","A3OSR3YW4IQRG4:3AUQQEL7U61MWB9MDX0WOYN0OCXV0U",1445967605159,"Gerald's graduation","llh","It is important for Rick to know whether both Gerald's mother and his father attended the ceremony.",0,0,1,"rel",0.14,13130,"English",NA,7,3,245552
"2575","A3P5WIW36V70AI:3KJYX6QCMAJTYHA8Z5A2632WNJ7JVP",1445876553207,"Chloe's holiday","lhh","Chloe recently got back from holidays.",0,1,1,"test_true",0.89,17489,"english",NA,8,6,256879
"2576","A3P5WIW36V70AI:3KJYX6QCMAJTYHA8Z5A2632WNJ7JVP",1445876569986,"Chloe's holiday","lhh","If Amelia brought some extra suntan lotion, it is likely that Susan brought some as well.",0,1,1,"prior",0.24,16776,"english",NA,8,6,256879
"2577","A3P5WIW36V70AI:3KJYX6QCMAJTYHA8Z5A2632WNJ7JVP",1445876580288,"Chloe's holiday","lhh","If Susan brought some extra suntan lotion, it is likely that Amelia brought some as well.",0,1,1,"prior",0.12,10301,"english",NA,8,6,256879
"2578","A3P5WIW36V70AI:3KJYX6QCMAJTYHA8Z5A2632WNJ7JVP",1445876609886,"Tony's clubbing","lhl","Tony has to work at club Macabre tonight.",0,1,0,"test_false",0,29596,"english",NA,8,6,256879
"2579","A3P5WIW36V70AI:3KJYX6QCMAJTYHA8Z5A2632WNJ7JVP",1445876616054,"Tony's clubbing","lhl","Rob knows whether they play both Jazz and Metal at the club tonight.",0,1,0,"comp",1,6167,"english",NA,8,6,256879
"2580","A3P5WIW36V70AI:3KJYX6QCMAJTYHA8Z5A2632WNJ7JVP",1445876639077,"Brad's clothes","hlh","Brad is not happy about the fact that his friends make jokes about his shabby clothes.",1,0,1,"test_true",1,23020,"english",NA,8,6,256879
"2581","A3P5WIW36V70AI:3KJYX6QCMAJTYHA8Z5A2632WNJ7JVP",1445876648742,"Brad's clothes","hlh","From what Gina said we may conclude that Brad did not buy both a sweater and a pair of jeans.",1,0,1,"xor",1,9663,"english",NA,8,6,256879
"2582","A3P5WIW36V70AI:3KJYX6QCMAJTYHA8Z5A2632WNJ7JVP",1445876667481,"Gerald's graduation","llh","Nico finally graduated after studying for a long time.",0,0,1,"test_false",1,18738,"english",NA,8,6,256879
"2583","A3P5WIW36V70AI:3KJYX6QCMAJTYHA8Z5A2632WNJ7JVP",1445876676887,"Gerald's graduation","llh","If Gerald's mother attended the ceremony, it is likely that his father attended as well.",0,0,1,"prior",0.2,9405,"english",NA,8,6,256879
"2584","A3P5WIW36V70AI:3KJYX6QCMAJTYHA8Z5A2632WNJ7JVP",1445876682274,"Gerald's graduation","llh","If Gerald's father attended the ceremony, it is likely that his mother attended as well.",0,0,1,"prior",0.17,5386,"english",NA,8,6,256879
"2585","A3P5WIW36V70AI:3KJYX6QCMAJTYHA8Z5A2632WNJ7JVP",1445876706635,"Jimmy's trip","lll","Jimmy went on a school trip to New York City.",0,0,0,"test_false",0,24360,"english",NA,8,6,256879
"2586","A3P5WIW36V70AI:3KJYX6QCMAJTYHA8Z5A2632WNJ7JVP",1445876716005,"Jimmy's trip","lll","It is important for the neighbors to know whether Jimmy visited both the Statue of Liberty and the Empire State Building.",0,0,0,"rel",0.19,9369,"english",NA,8,6,256879
"2587","A3P5WIW36V70AI:3KJYX6QCMAJTYHA8Z5A2632WNJ7JVP",1445876730589,"Pete's accident","hhl","Pete's mother was not there when he fell of the slide.",1,1,0,"test_true",1,14582,"english",NA,8,6,256879
"2588","A3P5WIW36V70AI:3KJYX6QCMAJTYHA8Z5A2632WNJ7JVP",1445876734478,"Pete's accident","hhl","The teacher knows whether Pete broke both his arm and his leg.",1,1,0,"comp",1,3887,"english",NA,8,6,256879
"2589","A3P5WIW36V70AI:3KJYX6QCMAJTYHA8Z5A2632WNJ7JVP",1445876760873,"Danny's racket","hhh","Danny and Alex have known each other since high school.",1,1,1,"test_uncertain",0.5,26394,"english",NA,8,6,256879
"2590","A3P5WIW36V70AI:3KJYX6QCMAJTYHA8Z5A2632WNJ7JVP",1445876769976,"Danny's racket","hhh","From what Alex's girlfriend said we may conclude that Alex did not buy both a racket and a pair of shoes.",1,1,1,"xor",0.91,9101,"english",NA,8,6,256879
"2591","A3P5WIW36V70AI:3KJYX6QCMAJTYHA8Z5A2632WNJ7JVP",1445876802947,"Carl's party","hll","Carl's wife liked the music very much.",1,0,0,"test_uncertain",0.5,32969,"english",NA,8,6,256879
"2592","A3P5WIW36V70AI:3KJYX6QCMAJTYHA8Z5A2632WNJ7JVP",1445876810086,"Carl's party","hll","It is important for Carl's wife to know whether Carl danced passionately with both Sue and Mary.",1,0,0,"rel",0.17,7137,"english",NA,8,6,256879
"2593","A3PD4Q4287A2G8:3Q5C1WP23N9556FP3PMJY5CBGG315Y",1445970911940,"Gerald's graduation","llh","Gerald took almost ten years to graduate.",0,0,1,"test_uncertain",0.53,25106,"english",NA,8,6,236823
"2594","A3PD4Q4287A2G8:3Q5C1WP23N9556FP3PMJY5CBGG315Y",1445970917550,"Gerald's graduation","llh","If Gerald's father attended the ceremony, it is likely that his mother attended as well.",0,0,1,"prior",0.26,5609,"english",NA,8,6,236823
"2595","A3PD4Q4287A2G8:3Q5C1WP23N9556FP3PMJY5CBGG315Y",1445970924322,"Gerald's graduation","llh","If Gerald's mother attended the ceremony, it is likely that his father attended as well.",0,0,1,"prior",0.21,6772,"english",NA,8,6,236823
"2596","A3PD4Q4287A2G8:3Q5C1WP23N9556FP3PMJY5CBGG315Y",1445970944817,"Chloe's holiday","lhh","Chloe recently got back from holidays.",0,1,1,"test_true",0.14,20495,"english",NA,8,6,236823
"2597","A3PD4Q4287A2G8:3Q5C1WP23N9556FP3PMJY5CBGG315Y",1445970958771,"Chloe's holiday","lhh","Chloe knows whether both Susan and Amelia brought some extra suntan lotion.",0,1,1,"comp",0.21,13954,"english",NA,8,6,236823
"2598","A3PD4Q4287A2G8:3Q5C1WP23N9556FP3PMJY5CBGG315Y",1445970970215,"Pete's accident","hhl","Pete's mother was not there when he fell of the slide.",1,1,0,"test_true",1,11443,"english",NA,8,6,236823
"2599","A3PD4Q4287A2G8:3Q5C1WP23N9556FP3PMJY5CBGG315Y",1445970976492,"Pete's accident","hhl","If Pete broke his arm, it is likely that he also broke his leg.",1,1,0,"prior",0,6276,"english",NA,8,6,236823
"2600","A3PD4Q4287A2G8:3Q5C1WP23N9556FP3PMJY5CBGG315Y",1445971008632,"Pete's accident","hhl","If Pete broke his leg, it is likely that he also broke his arm.",1,1,0,"prior",0,32139,"english",NA,8,6,236823
"2601","A3PD4Q4287A2G8:3Q5C1WP23N9556FP3PMJY5CBGG315Y",1445971029928,"Mrs Gibbs' worry","hhh","Cindy is secretly in love with Mrs Gibbs' husband.",1,1,1,"test_uncertain",0,21292,"english",NA,8,6,236823
"2602","A3PD4Q4287A2G8:3Q5C1WP23N9556FP3PMJY5CBGG315Y",1445971044320,"Mrs Gibbs' worry","hhh","From what Cindy said we may conclude that Mr Gibbs did not have both a steak and a beer.",1,1,1,"xor",0.95,14392,"english",NA,8,6,236823
"2603","A3PD4Q4287A2G8:3Q5C1WP23N9556FP3PMJY5CBGG315Y",1445971059979,"Brad's clothes","hlh","Mandy feels attracted to Brad.",1,0,1,"test_uncertain",0.25,15659,"english",NA,8,6,236823
"2604","A3PD4Q4287A2G8:3Q5C1WP23N9556FP3PMJY5CBGG315Y",1445971068096,"Brad's clothes","hlh","It is important for Mandy to know whether Brad bought both a sweater and a pair of jeans.",1,0,1,"rel",0.2,8117,"english",NA,8,6,236823
"2605","A3PD4Q4287A2G8:3Q5C1WP23N9556FP3PMJY5CBGG315Y",1445971083467,"Lily's husband","lhl","Eric and Lily went to a bar together last night.",0,1,0,"test_false",0,15370,"english",NA,8,6,236823
"2606","A3PD4Q4287A2G8:3Q5C1WP23N9556FP3PMJY5CBGG315Y",1445971092205,"Lily's husband","lhl","From what Bill said we may conclude that Eric did not drink both whisky and vodka.",0,1,0,"xor",0.95,8736,"english",NA,8,6,236823
"2607","A3PD4Q4287A2G8:3Q5C1WP23N9556FP3PMJY5CBGG315Y",1445971115109,"Harold's pet","lll","Harold's girlfriend didn't want a pet in her house before.",0,0,0,"test_true",1,22902,"english",NA,8,6,236823
"2608","A3PD4Q4287A2G8:3Q5C1WP23N9556FP3PMJY5CBGG315Y",1445971119033,"Harold's pet","lll","It is important for Tom to know whether Harold bought both a cat and a dog.",0,0,0,"rel",0.32,3924,"english",NA,8,6,236823
"2609","A3PD4Q4287A2G8:3Q5C1WP23N9556FP3PMJY5CBGG315Y",1445971136361,"Leo's wife","hll","Leo is an avid golf player.",1,0,0,"test_uncertain",0.12,17328,"english",NA,8,6,236823
"2610","A3PD4Q4287A2G8:3Q5C1WP23N9556FP3PMJY5CBGG315Y",1445971148763,"Leo's wife","hll","Hans knows whether someone just made a hole-in-one on both the first and the second hole.",1,0,0,"comp",0.11,12401,"english",NA,8,6,236823
"2611","A3POH7948KWXCF:3VELCLL3GLRX738E91ZSKH3O5AH1FH",1445967335949,"Gigi's exams","hlh","Gigi aspires to a career in science.",1,0,1,"test_uncertain",0.74,23363,"english","no",4,2,239142
"2612","A3POH7948KWXCF:3VELCLL3GLRX738E91ZSKH3O5AH1FH",1445967345591,"Gigi's exams","hlh","Carrie knows whether Gigi passed both her Physics exam and her Chemistry exam.",1,0,1,"comp",0.64,9639,"english","no",4,2,239142
"2613","A3POH7948KWXCF:3VELCLL3GLRX738E91ZSKH3O5AH1FH",1445967357725,"Pete's accident","hhl","Pete's teacher saw him fall off the slide.",1,1,0,"test_uncertain",0.35,12132,"english","no",4,2,239142
"2614","A3POH7948KWXCF:3VELCLL3GLRX738E91ZSKH3O5AH1FH",1445967364658,"Pete's accident","hhl","If Pete broke his arm, it is likely that he also broke his leg.",1,1,0,"prior",0.08,6931,"english","no",4,2,239142
"2615","A3POH7948KWXCF:3VELCLL3GLRX738E91ZSKH3O5AH1FH",1445967375365,"Pete's accident","hhl","If Pete broke his leg, it is likely that he also broke his arm.",1,1,0,"prior",0.04,10705,"english","no",4,2,239142
"2616","A3POH7948KWXCF:3VELCLL3GLRX738E91ZSKH3O5AH1FH",1445967398777,"Jimmy's trip","lll","Jimmy went on a school trip to New York City.",0,0,0,"test_false",0,23410,"english","no",4,2,239142
"2617","A3POH7948KWXCF:3VELCLL3GLRX738E91ZSKH3O5AH1FH",1445967408933,"Jimmy's trip","lll","From what the brother said we may conclude that Jimmy did not visit both the Statue of Liberty and the Empire State Building.",0,0,0,"xor",0,10153,"english","no",4,2,239142
"2618","A3POH7948KWXCF:3VELCLL3GLRX738E91ZSKH3O5AH1FH",1445967478462,"Leo's wife","hll","Leo is wealthy.",1,0,0,"test_true",0.81,69528,"english","no",4,2,239142
"2619","A3POH7948KWXCF:3VELCLL3GLRX738E91ZSKH3O5AH1FH",1445967484755,"Leo's wife","hll","Hans knows whether someone just made a hole-in-one on both the first and the second hole.",1,0,0,"comp",0.31,6291,"english","no",4,2,239142
"2620","A3POH7948KWXCF:3VELCLL3GLRX738E91ZSKH3O5AH1FH",1445967498491,"Tony's clubbing","lhl","Techno is quite different from Jazz and from Metal.",0,1,0,"test_true",0.78,13734,"english","no",4,2,239142
"2621","A3POH7948KWXCF:3VELCLL3GLRX738E91ZSKH3O5AH1FH",1445967503885,"Tony's clubbing","lhl","If they play Jazz at the club tonight, it is likely that they also play Metal.",0,1,0,"prior",0.06,5391,"english","no",4,2,239142
"2622","A3POH7948KWXCF:3VELCLL3GLRX738E91ZSKH3O5AH1FH",1445967507451,"Tony's clubbing","lhl","If they play Metal at the club tonight, it is likely that they also play Jazz.",0,1,0,"prior",0.06,3563,"english","no",4,2,239142
"2623","A3POH7948KWXCF:3VELCLL3GLRX738E91ZSKH3O5AH1FH",1445967521698,"Joshua's delay","llh","Kevin and Cory expected Joshua to arrive earlier.",0,0,1,"test_true",0.99,14246,"english","no",4,2,239142
"2624","A3POH7948KWXCF:3VELCLL3GLRX738E91ZSKH3O5AH1FH",1445967526520,"Joshua's delay","llh","It is important for Kevin to know whether Joshua had to both eat lunch and do his homework.",0,0,1,"rel",0.29,4819,"english","no",4,2,239142
"2625","A3POH7948KWXCF:3VELCLL3GLRX738E91ZSKH3O5AH1FH",1445967555611,"Danny's racket","hhh","Danny and Alex went to the sports store together.",1,1,1,"test_false",0,29090,"english","no",4,2,239142
"2626","A3POH7948KWXCF:3VELCLL3GLRX738E91ZSKH3O5AH1FH",1445967560282,"Danny's racket","hhh","From what Alex's girlfriend said we may conclude that Alex did not buy both a racket and a pair of shoes.",1,1,1,"xor",0.13,4669,"english","no",4,2,239142
"2627","A3POH7948KWXCF:3VELCLL3GLRX738E91ZSKH3O5AH1FH",1445967571529,"Chloe's holiday","lhh","Chloe forgot about bringing some beach towels, too.",0,1,1,"test_uncertain",0.1,11245,"english","no",4,2,239142
"2628","A3POH7948KWXCF:3VELCLL3GLRX738E91ZSKH3O5AH1FH",1445967575091,"Chloe's holiday","lhh","It is important for Chloe's father to know whether both Susan and Amelia brought some extra suntan lotion.",0,1,1,"rel",0.08,3560,"english","no",4,2,239142
"2629","A3PUU1XU4C1A3V:35DR22AR5ESAHSDEWZJXEHIS7ZR3X2",1445967391721,"Joshua's delay","llh","Kevin and Cory expected Joshua to arrive earlier.",0,0,1,"test_true",0.63,38414,"English","none, thanks",10,4,422334
"2630","A3PUU1XU4C1A3V:35DR22AR5ESAHSDEWZJXEHIS7ZR3X2",1445967409687,"Joshua's delay","llh","If Joshua had to do eat lunch, it is likely that he also had to do his homework.",0,0,1,"prior",0.12,17950,"English","none, thanks",10,4,422334
"2631","A3PUU1XU4C1A3V:35DR22AR5ESAHSDEWZJXEHIS7ZR3X2",1445967427787,"Joshua's delay","llh","If Joshua had to do his homework, it is likely that he also had to eat lunch.",0,0,1,"prior",0.31,18100,"English","none, thanks",10,4,422334
"2632","A3PUU1XU4C1A3V:35DR22AR5ESAHSDEWZJXEHIS7ZR3X2",1445967455001,"Gigi's exams","hlh","Gigi hired a private tutor to help her with her Biology and Chemistry exams.",1,0,1,"test_false",0.82,27214,"English","none, thanks",10,4,422334
"2633","A3PUU1XU4C1A3V:35DR22AR5ESAHSDEWZJXEHIS7ZR3X2",1445967470669,"Gigi's exams","hlh","It is important for Gigi's best friend to know whether Gigi passed both her Physics exam and her Chemistry exam.",1,0,1,"rel",0.4,15668,"English","none, thanks",10,4,422334
"2634","A3PUU1XU4C1A3V:35DR22AR5ESAHSDEWZJXEHIS7ZR3X2",1445967496503,"Lily's husband","lhl","Eric has a problem with his liver for which he has to stop drinking alcohol.",0,1,0,"test_uncertain",0.91,25834,"English","none, thanks",10,4,422334
"2635","A3PUU1XU4C1A3V:35DR22AR5ESAHSDEWZJXEHIS7ZR3X2",1445967510649,"Lily's husband","lhl","From what Bill said we may conclude that Eric did not drink both whisky and vodka.",0,1,0,"xor",0.11,14146,"English","none, thanks",10,4,422334
"2636","A3PUU1XU4C1A3V:35DR22AR5ESAHSDEWZJXEHIS7ZR3X2",1445967568064,"Bill's order","lhh","Jake and Bill spent a lot of time together that day.",0,1,1,"test_true",0.9,57415,"English","none, thanks",10,4,422334
"2637","A3PUU1XU4C1A3V:35DR22AR5ESAHSDEWZJXEHIS7ZR3X2",1445967623528,"Bill's order","lhh","Jake knows whether Bill ordered both a starter and a side dish.",0,1,1,"comp",0.5,55464,"English","none, thanks",10,4,422334
"2638","A3PUU1XU4C1A3V:35DR22AR5ESAHSDEWZJXEHIS7ZR3X2",1445967660164,"Carl's party","hll","John and Carl, the hosts, are a gay couple.",1,0,0,"test_false",0.27,36636,"English","none, thanks",10,4,422334
"2639","A3PUU1XU4C1A3V:35DR22AR5ESAHSDEWZJXEHIS7ZR3X2",1445967677827,"Carl's party","hll","From what John said we may conclude that Carl did not dance passionately with both Sue and Mary.",1,0,0,"xor",0.41,17663,"English","none, thanks",10,4,422334
"2640","A3PUU1XU4C1A3V:35DR22AR5ESAHSDEWZJXEHIS7ZR3X2",1445967702692,"Harold's pet","lll","Harold's girlfriend didn't want a pet in her house before.",0,0,0,"test_true",0.97,24849,"English","none, thanks",10,4,422334
"2641","A3PUU1XU4C1A3V:35DR22AR5ESAHSDEWZJXEHIS7ZR3X2",1445967718491,"Harold's pet","lll","Richard knows whether Harold bought both a cat and a dog.",0,0,0,"comp",0.11,15799,"English","none, thanks",10,4,422334
"2642","A3PUU1XU4C1A3V:35DR22AR5ESAHSDEWZJXEHIS7ZR3X2",1445967745840,"Mrs Gibbs' worry","hhh","Mrs Gibbs did not accompany her husband when Cindy served him.",1,1,1,"test_true",0.38,27349,"English","none, thanks",10,4,422334
"2643","A3PUU1XU4C1A3V:35DR22AR5ESAHSDEWZJXEHIS7ZR3X2",1445967766030,"Mrs Gibbs' worry","hhh","If Mr Gibbs had a beer, it is likely that he also had a steak.",1,1,1,"prior",0.61,20190,"English","none, thanks",10,4,422334
"2644","A3PUU1XU4C1A3V:35DR22AR5ESAHSDEWZJXEHIS7ZR3X2",1445967771325,"Mrs Gibbs' worry","hhh","If Mr Gibbs had a steak, it is likely that he also had a beer.",1,1,1,"prior",0.59,5292,"English","none, thanks",10,4,422334
"2645","A3PUU1XU4C1A3V:35DR22AR5ESAHSDEWZJXEHIS7ZR3X2",1445967798326,"Mrs Sanders' son","hhl","The teacher is trying to find out who queued up twice.",1,1,0,"test_true",0.15,27001,"English","none, thanks",10,4,422334
"2646","A3PUU1XU4C1A3V:35DR22AR5ESAHSDEWZJXEHIS7ZR3X2",1445967814055,"Mrs Sanders' son","hhl","It is important for the teacher to know whether Ted had both pizza and pasta.",1,1,0,"rel",0.49,15713,"English","none, thanks",10,4,422334
"2647","A3TDA1NWHNQFE3:3IXEICO793R2XURCARGYWH964U6T6G",1445970095362,"Mrs Sanders' son","hhl","Ted is Mrs Sanders' husband.",1,1,0,"test_false",0,18999,"English","None",7,2,539391
"2648","A3TDA1NWHNQFE3:3IXEICO793R2XURCARGYWH964U6T6G",1445970114017,"Mrs Sanders' son","hhl","Mrs Sanders knows whether Ted had both pizza and pasta.",1,1,0,"comp",0.63,18654,"English","None",7,2,539391
"2649","A3TDA1NWHNQFE3:3IXEICO793R2XURCARGYWH964U6T6G",1445970129862,"Leo's wife","hll","Leo is wealthy.",1,0,0,"test_true",0.75,15844,"English","None",7,2,539391
"2650","A3TDA1NWHNQFE3:3IXEICO793R2XURCARGYWH964U6T6G",1445970142085,"Leo's wife","hll","From what Hans said we may conclude that the player in question didn't make a hole-in-one on both the first and the second hole.",1,0,0,"xor",0.63,12221,"English","None",7,2,539391
"2651","A3TDA1NWHNQFE3:3IXEICO793R2XURCARGYWH964U6T6G",1445970158372,"Mrs Gibbs' worry","hhh","Mrs Gibbs did not accompany her husband when Cindy served him.",1,1,1,"test_true",0.68,16286,"English","None",7,2,539391
"2652","A3TDA1NWHNQFE3:3IXEICO793R2XURCARGYWH964U6T6G",1445970163582,"Mrs Gibbs' worry","hhh","It is important for Mrs Gibbs to know whether Mr Gibbs had both a steak and a beer.",1,1,1,"rel",0.56,5209,"English","None",7,2,539391
"2653","A3TDA1NWHNQFE3:3IXEICO793R2XURCARGYWH964U6T6G",1445970251804,"Gerald's graduation","llh","Nico finally graduated after studying for a long time.",0,0,1,"test_false",0.5,88221,"English","None",7,2,539391
"2654","A3TDA1NWHNQFE3:3IXEICO793R2XURCARGYWH964U6T6G",1445970256264,"Gerald's graduation","llh","Nico knows whether both Gerald's mother and his father attended the ceremony.",0,0,1,"comp",0.3,4459,"English","None",7,2,539391
"2655","A3TDA1NWHNQFE3:3IXEICO793R2XURCARGYWH964U6T6G",1445970354660,"Lily's husband","lhl","Eric has a problem with his liver for which he has to stop drinking alcohol.",0,1,0,"test_uncertain",0.61,98395,"English","None",7,2,539391
"2656","A3TDA1NWHNQFE3:3IXEICO793R2XURCARGYWH964U6T6G",1445970359536,"Lily's husband","lhl","It is important for Lily to know whether her husband drank both whisky and vodka.",0,1,0,"rel",0.6,4875,"English","None",7,2,539391
"2657","A3TDA1NWHNQFE3:3IXEICO793R2XURCARGYWH964U6T6G",1445970387640,"Gigi's exams","hlh","Gigi hired a private tutor to help her with her Biology and Chemistry exams.",1,0,1,"test_false",0.12,28103,"English","None",7,2,539391
"2658","A3TDA1NWHNQFE3:3IXEICO793R2XURCARGYWH964U6T6G",1445970393442,"Gigi's exams","hlh","If Gigi passed her Physics exam, it is likely that she also passed her Chemistry exam.",1,0,1,"prior",0.62,5801,"English","None",7,2,539391
"2659","A3TDA1NWHNQFE3:3IXEICO793R2XURCARGYWH964U6T6G",1445970398474,"Gigi's exams","hlh","If Gigi passed her Chemistry exam, it is likely that she also passed her Physics exam.",1,0,1,"prior",0.65,5032,"English","None",7,2,539391
"2660","A3TDA1NWHNQFE3:3IXEICO793R2XURCARGYWH964U6T6G",1445970469936,"Chloe's holiday","lhh","Chloe went on holidays with a big group of her friends.",0,1,1,"test_false",0.42,71461,"English","None",7,2,539391
"2661","A3TDA1NWHNQFE3:3IXEICO793R2XURCARGYWH964U6T6G",1445970476920,"Chloe's holiday","lhh","From what Chloe said we may conclude that Susan and Amelia did not both bring some extra suntan lotion.",0,1,1,"xor",0.81,6982,"English","None",7,2,539391
"2662","A3TDA1NWHNQFE3:3IXEICO793R2XURCARGYWH964U6T6G",1445970624560,"Jimmy's trip","lll","Jimmy had told his friends about his plans to visit New York City before.",0,0,0,"test_uncertain",0.38,147638,"English","None",7,2,539391
"2663","A3TDA1NWHNQFE3:3IXEICO793R2XURCARGYWH964U6T6G",1445970630556,"Jimmy's trip","lll","If Jimmy visited the Statue of Liberty, it is likely that he also visited the Empire State Building.",0,0,0,"prior",0.41,5996,"English","None",7,2,539391
"2664","A3TDA1NWHNQFE3:3IXEICO793R2XURCARGYWH964U6T6G",1445970634753,"Jimmy's trip","lll","If Jimmy visited the Empire State Building, it is likely that he also visited the Statue of Liberty.",0,0,0,"prior",0.4,4196,"English","None",7,2,539391
"2665","A3UV55HC87DO9C:3PMBY0YE28B8TWRZMCOKRH0469D9CN",1445967602622,"Gigi's exams","hlh","Gigi hired a private tutor to help her with her Biology and Chemistry exams.",1,0,1,"test_false",0.66,16519,"english",NA,5,5,172347
"2666","A3UV55HC87DO9C:3PMBY0YE28B8TWRZMCOKRH0469D9CN",1445967613827,"Gigi's exams","hlh","It is important for Gigi's best friend to know whether Gigi passed both her Physics exam and her Chemistry exam.",1,0,1,"rel",0.61,11204,"english",NA,5,5,172347
"2667","A3UV55HC87DO9C:3PMBY0YE28B8TWRZMCOKRH0469D9CN",1445967633209,"Lily's husband","lhl","Eric's doctor told him to stop drinking alcohol.",0,1,0,"test_true",0.79,19381,"english",NA,5,5,172347
"2668","A3UV55HC87DO9C:3PMBY0YE28B8TWRZMCOKRH0469D9CN",1445967643810,"Lily's husband","lhl","From what Bill said we may conclude that Eric did not drink both whisky and vodka.",0,1,0,"xor",0.21,10600,"english",NA,5,5,172347
"2669","A3UV55HC87DO9C:3PMBY0YE28B8TWRZMCOKRH0469D9CN",1445967665514,"Mrs Sanders' son","hhl","The teacher is trying to find out who queued up twice.",1,1,0,"test_true",0.71,21703,"english",NA,5,5,172347
"2670","A3UV55HC87DO9C:3PMBY0YE28B8TWRZMCOKRH0469D9CN",1445967668880,"Mrs Sanders' son","hhl","It is important for the teacher to know whether Ted had both pizza and pasta.",1,1,0,"rel",0.7,3365,"english",NA,5,5,172347
"2671","A3UV55HC87DO9C:3PMBY0YE28B8TWRZMCOKRH0469D9CN",1445967684833,"Joshua's delay","llh","Kevin, Cory and Joshua are brothers.",0,0,1,"test_false",0.5,15953,"english",NA,5,5,172347
"2672","A3UV55HC87DO9C:3PMBY0YE28B8TWRZMCOKRH0469D9CN",1445967690919,"Joshua's delay","llh","If Joshua had to do his homework, it is likely that he also had to eat lunch.",0,0,1,"prior",0.59,6085,"english",NA,5,5,172347
"2673","A3UV55HC87DO9C:3PMBY0YE28B8TWRZMCOKRH0469D9CN",1445967695340,"Joshua's delay","llh","If Joshua had to do eat lunch, it is likely that he also had to do his homework.",0,0,1,"prior",0.5,4420,"english",NA,5,5,172347
"2674","A3UV55HC87DO9C:3PMBY0YE28B8TWRZMCOKRH0469D9CN",1445967704785,"Bill's order","lhh","Jake ordered a steak.",0,1,1,"test_uncertain",0.5,9443,"english",NA,5,5,172347
"2675","A3UV55HC87DO9C:3PMBY0YE28B8TWRZMCOKRH0469D9CN",1445967712654,"Bill's order","lhh","Jake knows whether Bill ordered both a starter and a side dish.",0,1,1,"comp",0.74,7868,"english",NA,5,5,172347
"2676","A3UV55HC87DO9C:3PMBY0YE28B8TWRZMCOKRH0469D9CN",1445967724623,"Danny's racket","hhh","Danny and Alex have known each other since high school.",1,1,1,"test_uncertain",0.5,11969,"english",NA,5,5,172347
"2677","A3UV55HC87DO9C:3PMBY0YE28B8TWRZMCOKRH0469D9CN",1445967728054,"Danny's racket","hhh","If Alex bought a pair of shoes, it is likely that he also bought a racket.",1,1,1,"prior",0.5,3430,"english",NA,5,5,172347
"2678","A3UV55HC87DO9C:3PMBY0YE28B8TWRZMCOKRH0469D9CN",1445967734495,"Danny's racket","hhh","If Alex bought a racket, it is likely that he also bought a pair of shoes.",1,1,1,"prior",0.61,6440,"english",NA,5,5,172347
"2679","A3UV55HC87DO9C:3PMBY0YE28B8TWRZMCOKRH0469D9CN",1445967753354,"Harold's pet","lll","Harold's girlfriend gave in because Harold kept nagging her about wanting a pet.",0,0,0,"test_uncertain",0.76,18857,"english",NA,5,5,172347
"2680","A3UV55HC87DO9C:3PMBY0YE28B8TWRZMCOKRH0469D9CN",1445967760781,"Harold's pet","lll","Richard knows whether Harold bought both a cat and a dog.",0,0,0,"comp",0.5,7426,"english",NA,5,5,172347
"2681","A3UV55HC87DO9C:3PMBY0YE28B8TWRZMCOKRH0469D9CN",1445967770338,"Leo's wife","hll","Leo is an avid golf player.",1,0,0,"test_uncertain",0.5,9556,"english",NA,5,5,172347
"2682","A3UV55HC87DO9C:3PMBY0YE28B8TWRZMCOKRH0469D9CN",1445967774969,"Leo's wife","hll","From what Hans said we may conclude that the player in question didn't make a hole-in-one on both the first and the second hole.",1,0,0,"xor",0.6,4631,"english",NA,5,5,172347
"2683","A3V0ECSC892EW9:34MAJL3QP5VJJQP4COHSH6LUE4M43O",1445970076663,"Mrs Sanders' son","hhl","Mrs Sanders had pasta for lunch yesterday.",1,1,0,"test_uncertain",0.69,130591,"english",NA,5,7,116752
"2684","A3V0ECSC892EW9:34MAJL3QP5VJJQP4COHSH6LUE4M43O",1445970078583,"Mrs Sanders' son","hhl","If Ted had pizza, it is likely that he also had pasta.",1,1,0,"prior",0.26,1919,"english",NA,5,7,116752
"2685","A3V0ECSC892EW9:34MAJL3QP5VJJQP4COHSH6LUE4M43O",1445970085537,"Mrs Sanders' son","hhl","If Ted had pasta, it is likely that he also had pizza.",1,1,0,"prior",0.23,6952,"english",NA,5,7,116752
"2686","A3V0ECSC892EW9:34MAJL3QP5VJJQP4COHSH6LUE4M43O",1445970095656,"Bill's order","lhh","Jake and Bill went to the restaurant before they went jogging.",0,1,1,"test_false",0.7,10116,"english",NA,5,7,116752
"2687","A3V0ECSC892EW9:34MAJL3QP5VJJQP4COHSH6LUE4M43O",1445970100352,"Bill's order","lhh","It is important for Bill's wife to know whether Bill ordered both a starter and a side dish.",0,1,1,"rel",0.34,4693,"english",NA,5,7,116752
"2688","A3V0ECSC892EW9:34MAJL3QP5VJJQP4COHSH6LUE4M43O",1445970127672,"Tony's clubbing","lhl","Rob is a big fan of Techno music as well.",0,1,0,"test_uncertain",0.63,27318,"english",NA,5,7,116752
"2689","A3V0ECSC892EW9:34MAJL3QP5VJJQP4COHSH6LUE4M43O",1445970163197,"Tony's clubbing","lhl","Rob knows whether they play both Jazz and Metal at the club tonight.",0,1,0,"comp",0.28,35522,"english",NA,5,7,116752
