"","id","itemTime","name","type","question","relevance","competence","prior","condition","answer","RT","language","comments","engagement","difficulty","time"
"1767","A2T3OG7CRWIA6E:3OXV7EAXLFYXYDTIVCA7E458AVR367",1445967423572,"Harold's pet","lll","Harold's girlfriend gave in because Harold kept nagging her about wanting a pet.",0,0,0,"test_uncertain",0.79,14829,"English",NA,7,4,227456
"1768","A2T3OG7CRWIA6E:3OXV7EAXLFYXYDTIVCA7E458AVR367",1445967431876,"Harold's pet","lll","If Harold bought a cat, it is likely that he bought a dog as well.",0,0,0,"prior",0.21,8300,"English",NA,7,4,227456
"1769","A2T3OG7CRWIA6E:3OXV7EAXLFYXYDTIVCA7E458AVR367",1445967437965,"Harold's pet","lll","If Harold bought a dog, it is likely that he bought a cat as well.",0,0,0,"prior",0.13,6086,"English",NA,7,4,227456
"1770","A2T3OG7CRWIA6E:3OXV7EAXLFYXYDTIVCA7E458AVR367",1445967468783,"Carl's party","hll","John and Carl, the hosts, are a gay couple.",1,0,0,"test_false",0,30814,"English",NA,7,4,227456
"1771","A2T3OG7CRWIA6E:3OXV7EAXLFYXYDTIVCA7E458AVR367",1445967477788,"Carl's party","hll","From what John said we may conclude that Carl did not dance passionately with both Sue and Mary.",1,0,0,"xor",0.02,8999,"English",NA,7,4,227456
"1772","A2T3OG7CRWIA6E:3OXV7EAXLFYXYDTIVCA7E458AVR367",1445967488708,"Lily's husband","lhl","Eric and Lily went to a bar together last night.",0,1,0,"test_false",0,10916,"English",NA,7,4,227456
"1773","A2T3OG7CRWIA6E:3OXV7EAXLFYXYDTIVCA7E458AVR367",1445967496867,"Lily's husband","lhl","If Eric drank vodka, it is likely that he drank whisky as well.",0,1,0,"prior",0.6,8157,"English",NA,7,4,227456
"1774","A2T3OG7CRWIA6E:3OXV7EAXLFYXYDTIVCA7E458AVR367",1445967502267,"Lily's husband","lhl","If Eric drank whisky, it is likely that he drank vodka as well.",0,1,0,"prior",0.62,5397,"English",NA,7,4,227456
"1775","A2T3OG7CRWIA6E:3OXV7EAXLFYXYDTIVCA7E458AVR367",1445967571990,"Danny's racket","hhh","Alex needs to buy some equipment before he can play squash with Danny.",1,1,1,"test_true",1,69719,"English",NA,7,4,227456
"1776","A2T3OG7CRWIA6E:3OXV7EAXLFYXYDTIVCA7E458AVR367",1445967576844,"Danny's racket","hhh","Alex's girlfriend knows whether Alex bought both a racket and a pair of shoes.",1,1,1,"comp",0.67,4848,"English",NA,7,4,227456
"1777","A2T3OG7CRWIA6E:3OXV7EAXLFYXYDTIVCA7E458AVR367",1445967589730,"Pete's accident","hhl","Pete was injured while playing in the garden.",1,1,0,"test_false",0,12882,"English",NA,7,4,227456
"1778","A2T3OG7CRWIA6E:3OXV7EAXLFYXYDTIVCA7E458AVR367",1445967593634,"Pete's accident","hhl","From what Pete's teacher said we may conclude that Pete did not break both his arm and his leg.",1,1,0,"xor",0.02,3901,"English",NA,7,4,227456
"1779","A2T3OG7CRWIA6E:3OXV7EAXLFYXYDTIVCA7E458AVR367",1445967603914,"Bill's order","lhh","Jake ordered a steak.",0,1,1,"test_uncertain",0.5,10277,"English",NA,7,4,227456
"1780","A2T3OG7CRWIA6E:3OXV7EAXLFYXYDTIVCA7E458AVR367",1445967611691,"Bill's order","lhh","It is important for Bill's wife to know whether Bill ordered both a starter and a side dish.",0,1,1,"rel",0.52,7774,"English",NA,7,4,227456
"1781","A2T3OG7CRWIA6E:3OXV7EAXLFYXYDTIVCA7E458AVR367",1445967621834,"Brad's clothes","hlh","Gina and Mandy accompanied Brad on his shopping trip.",1,0,1,"test_false",0,10140,"English",NA,7,4,227456
"1782","A2T3OG7CRWIA6E:3OXV7EAXLFYXYDTIVCA7E458AVR367",1445967627434,"Brad's clothes","hlh","Gina knows whether Brad bought both a sweater and a pair of jeans.",1,0,1,"comp",0.14,5598,"English",NA,7,4,227456
"1783","A2TDB54MRSL3RR:3W92K5RLWVPLRIVNA3685TJR5K95VQ",1445967412312,"Gigi's exams","hlh","Gigi hired a private tutor to help her with her Biology and Chemistry exams.",1,0,1,"test_false",0.91,42039,"English","No",9,0,333965
"1784","A2TDB54MRSL3RR:3W92K5RLWVPLRIVNA3685TJR5K95VQ",1445967434208,"Gigi's exams","hlh","From what Carrie said we may conclude that Gigi did not pass both her Physics exam and her Chemistry exam.",1,0,1,"xor",0.12,21894,"English","No",9,0,333965
"1785","A2TDB54MRSL3RR:3W92K5RLWVPLRIVNA3685TJR5K95VQ",1445967464242,"Mrs Sanders' son","hhl","Ted is Mrs Sanders' husband.",1,1,0,"test_false",0,30032,"English","No",9,0,333965
"1786","A2TDB54MRSL3RR:3W92K5RLWVPLRIVNA3685TJR5K95VQ",1445967489042,"Mrs Sanders' son","hhl","If Ted had pasta, it is likely that he also had pizza.",1,1,0,"prior",0.03,24797,"English","No",9,0,333965
"1787","A2TDB54MRSL3RR:3W92K5RLWVPLRIVNA3685TJR5K95VQ",1445967497970,"Mrs Sanders' son","hhl","If Ted had pizza, it is likely that he also had pasta.",1,1,0,"prior",0.06,8927,"English","No",9,0,333965
"1788","A2TDB54MRSL3RR:3W92K5RLWVPLRIVNA3685TJR5K95VQ",1445967519875,"Lily's husband","lhl","Eric has a problem with his liver for which he has to stop drinking alcohol.",0,1,0,"test_uncertain",1,21904,"English","No",9,0,333965
"1789","A2TDB54MRSL3RR:3W92K5RLWVPLRIVNA3685TJR5K95VQ",1445967529432,"Lily's husband","lhl","It is important for Lily to know whether her husband drank both whisky and vodka.",0,1,0,"rel",1,9556,"English","No",9,0,333965
"1790","A2TDB54MRSL3RR:3W92K5RLWVPLRIVNA3685TJR5K95VQ",1445967548954,"Chloe's holiday","lhh","Chloe went on holidays with a big group of her friends.",0,1,1,"test_false",0,19520,"English","No",9,0,333965
"1791","A2TDB54MRSL3RR:3W92K5RLWVPLRIVNA3685TJR5K95VQ",1445967558819,"Chloe's holiday","lhh","Chloe knows whether both Susan and Amelia brought some extra suntan lotion.",0,1,1,"comp",1,9862,"English","No",9,0,333965
"1792","A2TDB54MRSL3RR:3W92K5RLWVPLRIVNA3685TJR5K95VQ",1445967583821,"Danny's racket","hhh","Alex needs to buy some equipment before he can play squash with Danny.",1,1,1,"test_true",0.97,25001,"English","No",9,0,333965
"1793","A2TDB54MRSL3RR:3W92K5RLWVPLRIVNA3685TJR5K95VQ",1445967606539,"Danny's racket","hhh","It is important for Danny to know whether Alex bought both a racket and a pair of shoes.",1,1,1,"rel",0.96,22716,"English","No",9,0,333965
"1794","A2TDB54MRSL3RR:3W92K5RLWVPLRIVNA3685TJR5K95VQ",1445967623691,"Leo's wife","hll","Leo is wealthy.",1,0,0,"test_true",0.93,17150,"English","No",9,0,333965
"1795","A2TDB54MRSL3RR:3W92K5RLWVPLRIVNA3685TJR5K95VQ",1445967633715,"Leo's wife","hll","If someone made a hole-in-one on the second hole, it is likely that she also made one on the first hole.",1,0,0,"prior",0.01,10022,"English","No",9,0,333965
"1796","A2TDB54MRSL3RR:3W92K5RLWVPLRIVNA3685TJR5K95VQ",1445967641341,"Leo's wife","hll","If someone made a hole-in-one on the first hole, it is likely that she also made one on the second hole.",1,0,0,"prior",0.04,7624,"English","No",9,0,333965
"1797","A2TDB54MRSL3RR:3W92K5RLWVPLRIVNA3685TJR5K95VQ",1445967674972,"Joshua's delay","llh","Kevin, Cory and Joshua are brothers.",0,0,1,"test_false",0,33630,"English","No",9,0,333965
"1798","A2TDB54MRSL3RR:3W92K5RLWVPLRIVNA3685TJR5K95VQ",1445967694150,"Joshua's delay","llh","From what Cory said we may conclude that Joshua did not have to both eat lunch and do his homework.",0,0,1,"xor",0.32,19177,"English","No",9,0,333965
"1799","A2TDB54MRSL3RR:3W92K5RLWVPLRIVNA3685TJR5K95VQ",1445967738588,"Jimmy's trip","lll","Jimmy went on a school trip to New York City.",0,0,0,"test_false",0.05,44437,"English","No",9,0,333965
"1800","A2TDB54MRSL3RR:3W92K5RLWVPLRIVNA3685TJR5K95VQ",1445967746277,"Jimmy's trip","lll","Jimmy's brother knows whether Jimmy visited both the Statue of Liberty and the Empire State Building.",0,0,0,"comp",0.01,7687,"English","No",9,0,333965
"1801","A2U92EC7PR8JLR:3HPZF4IVNN1NUXZ7UOG0QYTVFIXYC0",1445967265048,"Harold's pet","lll","Harold is single.",0,0,0,"test_false",0.73,24124,"English","Had fun doing the tasks. Was a little disappointed that it finished faster than I anticipated.",8,3,268582
"1802","A2U92EC7PR8JLR:3HPZF4IVNN1NUXZ7UOG0QYTVFIXYC0",1445967281319,"Harold's pet","lll","From what Richard said we may conclude that Harold did not buy both a cat and a dog.",0,0,0,"xor",0.81,16267,"English","Had fun doing the tasks. Was a little disappointed that it finished faster than I anticipated.",8,3,268582
"1803","A2U92EC7PR8JLR:3HPZF4IVNN1NUXZ7UOG0QYTVFIXYC0",1445967300755,"Brad's clothes","hlh","Gina and Mandy accompanied Brad on his shopping trip.",1,0,1,"test_false",0.14,19433,"English","Had fun doing the tasks. Was a little disappointed that it finished faster than I anticipated.",8,3,268582
"1804","A2U92EC7PR8JLR:3HPZF4IVNN1NUXZ7UOG0QYTVFIXYC0",1445967308468,"Brad's clothes","hlh","It is important for Mandy to know whether Brad bought both a sweater and a pair of jeans.",1,0,1,"rel",0.59,7709,"English","Had fun doing the tasks. Was a little disappointed that it finished faster than I anticipated.",8,3,268582
"1805","A2U92EC7PR8JLR:3HPZF4IVNN1NUXZ7UOG0QYTVFIXYC0",1445967328894,"Mrs Gibbs' worry","hhh","Cindy is secretly in love with Mrs Gibbs' husband.",1,1,1,"test_uncertain",0.19,20424,"English","Had fun doing the tasks. Was a little disappointed that it finished faster than I anticipated.",8,3,268582
"1806","A2U92EC7PR8JLR:3HPZF4IVNN1NUXZ7UOG0QYTVFIXYC0",1445967334865,"Mrs Gibbs' worry","hhh","From what Cindy said we may conclude that Mr Gibbs did not have both a steak and a beer.",1,1,1,"xor",0.67,5968,"English","Had fun doing the tasks. Was a little disappointed that it finished faster than I anticipated.",8,3,268582
"1807","A2U92EC7PR8JLR:3HPZF4IVNN1NUXZ7UOG0QYTVFIXYC0",1445967357698,"Bill's order","lhh","Jake and Bill went to the restaurant before they went jogging.",0,1,1,"test_false",0,22831,"English","Had fun doing the tasks. Was a little disappointed that it finished faster than I anticipated.",8,3,268582
"1808","A2U92EC7PR8JLR:3HPZF4IVNN1NUXZ7UOG0QYTVFIXYC0",1445967377132,"Bill's order","lhh","Jake knows whether Bill ordered both a starter and a side dish.",0,1,1,"comp",0.69,19432,"English","Had fun doing the tasks. Was a little disappointed that it finished faster than I anticipated.",8,3,268582
"1809","A2U92EC7PR8JLR:3HPZF4IVNN1NUXZ7UOG0QYTVFIXYC0",1445967401800,"Carl's party","hll","Carl's wife liked the music very much.",1,0,0,"test_uncertain",0.36,24666,"English","Had fun doing the tasks. Was a little disappointed that it finished faster than I anticipated.",8,3,268582
"1810","A2U92EC7PR8JLR:3HPZF4IVNN1NUXZ7UOG0QYTVFIXYC0",1445967415676,"Carl's party","hll","It is important for Carl's wife to know whether Carl danced passionately with both Sue and Mary.",1,0,0,"rel",0.55,13874,"English","Had fun doing the tasks. Was a little disappointed that it finished faster than I anticipated.",8,3,268582
"1811","A2U92EC7PR8JLR:3HPZF4IVNN1NUXZ7UOG0QYTVFIXYC0",1445967441342,"Mrs Sanders' son","hhl","Ted is Mrs Sanders' husband.",1,1,0,"test_false",0,25663,"English","Had fun doing the tasks. Was a little disappointed that it finished faster than I anticipated.",8,3,268582
"1812","A2U92EC7PR8JLR:3HPZF4IVNN1NUXZ7UOG0QYTVFIXYC0",1445967454401,"Mrs Sanders' son","hhl","If Ted had pasta, it is likely that he also had pizza.",1,1,0,"prior",0.35,13056,"English","Had fun doing the tasks. Was a little disappointed that it finished faster than I anticipated.",8,3,268582
"1813","A2U92EC7PR8JLR:3HPZF4IVNN1NUXZ7UOG0QYTVFIXYC0",1445967460927,"Mrs Sanders' son","hhl","If Ted had pizza, it is likely that he also had pasta.",1,1,0,"prior",0.35,6523,"English","Had fun doing the tasks. Was a little disappointed that it finished faster than I anticipated.",8,3,268582
"1814","A2U92EC7PR8JLR:3HPZF4IVNN1NUXZ7UOG0QYTVFIXYC0",1445967479512,"Tony's clubbing","lhl","Techno is quite different from Jazz and from Metal.",0,1,0,"test_true",0.9,18582,"English","Had fun doing the tasks. Was a little disappointed that it finished faster than I anticipated.",8,3,268582
"1815","A2U92EC7PR8JLR:3HPZF4IVNN1NUXZ7UOG0QYTVFIXYC0",1445967489288,"Tony's clubbing","lhl","Rob knows whether they play both Jazz and Metal at the club tonight.",0,1,0,"comp",0.59,9773,"English","Had fun doing the tasks. Was a little disappointed that it finished faster than I anticipated.",8,3,268582
"1816","A2U92EC7PR8JLR:3HPZF4IVNN1NUXZ7UOG0QYTVFIXYC0",1445967513821,"Gerald's graduation","llh","Nico finally graduated after studying for a long time.",0,0,1,"test_false",0.31,24530,"English","Had fun doing the tasks. Was a little disappointed that it finished faster than I anticipated.",8,3,268582
"1817","A2U92EC7PR8JLR:3HPZF4IVNN1NUXZ7UOG0QYTVFIXYC0",1445967527540,"Gerald's graduation","llh","If Gerald's father attended the ceremony, it is likely that his mother attended as well.",0,0,1,"prior",0.55,13716,"English","Had fun doing the tasks. Was a little disappointed that it finished faster than I anticipated.",8,3,268582
"1818","A2U92EC7PR8JLR:3HPZF4IVNN1NUXZ7UOG0QYTVFIXYC0",1445967533630,"Gerald's graduation","llh","If Gerald's mother attended the ceremony, it is likely that his father attended as well.",0,0,1,"prior",0.56,6087,"English","Had fun doing the tasks. Was a little disappointed that it finished faster than I anticipated.",8,3,268582
"1819","A2WL2JC37BE2QT:3TK8OJTYM2TPKSD6UIFM3ZO8WICVP0",1445878210078,"Joshua's delay","llh","Kevin, Cory and Joshua do not like to hang out with girls.",0,0,1,"test_uncertain",0.68,21400,"English",NA,4,3,275409
"1820","A2WL2JC37BE2QT:3TK8OJTYM2TPKSD6UIFM3ZO8WICVP0",1445878225630,"Joshua's delay","llh","If Joshua had to do eat lunch, it is likely that he also had to do his homework.",0,0,1,"prior",0.56,15549,"English",NA,4,3,275409
"1821","A2WL2JC37BE2QT:3TK8OJTYM2TPKSD6UIFM3ZO8WICVP0",1445878232958,"Joshua's delay","llh","If Joshua had to do his homework, it is likely that he also had to eat lunch.",0,0,1,"prior",0.56,7325,"English",NA,4,3,275409
"1822","A2WL2JC37BE2QT:3TK8OJTYM2TPKSD6UIFM3ZO8WICVP0",1445878256238,"Mrs Sanders' son","hhl","Ted is Mrs Sanders' husband.",1,1,0,"test_false",0,23276,"English",NA,4,3,275409
"1823","A2WL2JC37BE2QT:3TK8OJTYM2TPKSD6UIFM3ZO8WICVP0",1445878267748,"Mrs Sanders' son","hhl","It is important for the teacher to know whether Ted had both pizza and pasta.",1,1,0,"rel",0.12,11504,"English",NA,4,3,275409
"1824","A2WL2JC37BE2QT:3TK8OJTYM2TPKSD6UIFM3ZO8WICVP0",1445878281988,"Brad's clothes","hlh","Brad is not happy about the fact that his friends make jokes about his shabby clothes.",1,0,1,"test_true",1,14239,"English",NA,4,3,275409
"1825","A2WL2JC37BE2QT:3TK8OJTYM2TPKSD6UIFM3ZO8WICVP0",1445878288652,"Brad's clothes","hlh","Gina knows whether Brad bought both a sweater and a pair of jeans.",1,0,1,"comp",0.15,6662,"English",NA,4,3,275409
"1826","A2WL2JC37BE2QT:3TK8OJTYM2TPKSD6UIFM3ZO8WICVP0",1445878307256,"Tony's clubbing","lhl","Techno is quite different from Jazz and from Metal.",0,1,0,"test_true",0.87,18600,"English",NA,4,3,275409
"1827","A2WL2JC37BE2QT:3TK8OJTYM2TPKSD6UIFM3ZO8WICVP0",1445878314811,"Tony's clubbing","lhl","If they play Jazz at the club tonight, it is likely that they also play Metal.",0,1,0,"prior",0.09,7552,"English",NA,4,3,275409
"1828","A2WL2JC37BE2QT:3TK8OJTYM2TPKSD6UIFM3ZO8WICVP0",1445878319547,"Tony's clubbing","lhl","If they play Metal at the club tonight, it is likely that they also play Jazz.",0,1,0,"prior",0.12,4733,"English",NA,4,3,275409
"1829","A2WL2JC37BE2QT:3TK8OJTYM2TPKSD6UIFM3ZO8WICVP0",1445878346789,"Chloe's holiday","lhh","Chloe went on holidays with a big group of her friends.",0,1,1,"test_false",0.74,27240,"English",NA,4,3,275409
"1830","A2WL2JC37BE2QT:3TK8OJTYM2TPKSD6UIFM3ZO8WICVP0",1445878358034,"Chloe's holiday","lhh","From what Chloe said we may conclude that Susan and Amelia did not both bring some extra suntan lotion.",0,1,1,"xor",0.2,11240,"English",NA,4,3,275409
"1831","A2WL2JC37BE2QT:3TK8OJTYM2TPKSD6UIFM3ZO8WICVP0",1445878406884,"Leo's wife","hll","Leo is sponsoring a tennis tournament.",1,0,0,"test_false",0,48845,"English",NA,4,3,275409
"1832","A2WL2JC37BE2QT:3TK8OJTYM2TPKSD6UIFM3ZO8WICVP0",1445878414489,"Leo's wife","hll","Hans knows whether someone just made a hole-in-one on both the first and the second hole.",1,0,0,"comp",0.19,7599,"English",NA,4,3,275409
"1833","A2WL2JC37BE2QT:3TK8OJTYM2TPKSD6UIFM3ZO8WICVP0",1445878439288,"Harold's pet","lll","Harold's girlfriend didn't want a pet in her house before.",0,0,0,"test_true",1,24794,"English",NA,4,3,275409
"1834","A2WL2JC37BE2QT:3TK8OJTYM2TPKSD6UIFM3ZO8WICVP0",1445878460303,"Harold's pet","lll","From what Richard said we may conclude that Harold did not buy both a cat and a dog.",0,0,0,"xor",0.75,21013,"English",NA,4,3,275409
"1835","A2WL2JC37BE2QT:3TK8OJTYM2TPKSD6UIFM3ZO8WICVP0",1445878479367,"Danny's racket","hhh","Danny and Alex have known each other since high school.",1,1,1,"test_uncertain",0.28,19062,"English",NA,4,3,275409
"1836","A2WL2JC37BE2QT:3TK8OJTYM2TPKSD6UIFM3ZO8WICVP0",1445878485487,"Danny's racket","hhh","It is important for Danny to know whether Alex bought both a racket and a pair of shoes.",1,1,1,"rel",0.88,6117,"English",NA,4,3,275409
"1837","A2WLGVXAVT2XTR:3UJ1CZ6IZIX5ZQEJG813U6ZK6GF5SL",1445970172041,"Gigi's exams","hlh","Gigi hired a private tutor to help her with her Biology and Chemistry exams.",1,0,1,"test_false",0.56,40650,"English","No.",10,6,233232
"1838","A2WLGVXAVT2XTR:3UJ1CZ6IZIX5ZQEJG813U6ZK6GF5SL",1445970181712,"Gigi's exams","hlh","It is important for Gigi's best friend to know whether Gigi passed both her Physics exam and her Chemistry exam.",1,0,1,"rel",0.33,9670,"English","No.",10,6,233232
"1839","A2WLGVXAVT2XTR:3UJ1CZ6IZIX5ZQEJG813U6ZK6GF5SL",1445970200800,"Lily's husband","lhl","Eric has a problem with his liver for which he has to stop drinking alcohol.",0,1,0,"test_uncertain",0.6,19087,"English","No.",10,6,233232
"1840","A2WLGVXAVT2XTR:3UJ1CZ6IZIX5ZQEJG813U6ZK6GF5SL",1445970220777,"Lily's husband","lhl","From what Bill said we may conclude that Eric did not drink both whisky and vodka.",0,1,0,"xor",0.98,19976,"English","No.",10,6,233232
"1841","A2WLGVXAVT2XTR:3UJ1CZ6IZIX5ZQEJG813U6ZK6GF5SL",1445970233513,"Pete's accident","hhl","Pete's teacher saw him fall off the slide.",1,1,0,"test_uncertain",0.51,12735,"English","No.",10,6,233232
"1842","A2WLGVXAVT2XTR:3UJ1CZ6IZIX5ZQEJG813U6ZK6GF5SL",1445970251809,"Pete's accident","hhl","The teacher knows whether Pete broke both his arm and his leg.",1,1,0,"comp",0.86,18295,"English","No.",10,6,233232
"1843","A2WLGVXAVT2XTR:3UJ1CZ6IZIX5ZQEJG813U6ZK6GF5SL",1445970270625,"Joshua's delay","llh","Kevin, Cory and Joshua do not like to hang out with girls.",0,0,1,"test_uncertain",0.72,18815,"English","No.",10,6,233232
"1844","A2WLGVXAVT2XTR:3UJ1CZ6IZIX5ZQEJG813U6ZK6GF5SL",1445970291920,"Joshua's delay","llh","If Joshua had to do eat lunch, it is likely that he also had to do his homework.",0,0,1,"prior",0.58,21293,"English","No.",10,6,233232
"1845","A2WLGVXAVT2XTR:3UJ1CZ6IZIX5ZQEJG813U6ZK6GF5SL",1445970298464,"Joshua's delay","llh","If Joshua had to do his homework, it is likely that he also had to eat lunch.",0,0,1,"prior",0.51,6544,"English","No.",10,6,233232
"1846","A2WLGVXAVT2XTR:3UJ1CZ6IZIX5ZQEJG813U6ZK6GF5SL",1445970316344,"Mrs Gibbs' worry","hhh","Cindy is secretly in love with Mrs Gibbs' husband.",1,1,1,"test_uncertain",0.29,17879,"English","No.",10,6,233232
"1847","A2WLGVXAVT2XTR:3UJ1CZ6IZIX5ZQEJG813U6ZK6GF5SL",1445970323296,"Mrs Gibbs' worry","hhh","Cindy knows whether Mr Gibbs had both a steak and a beer.",1,1,1,"comp",1,6951,"English","No.",10,6,233232
"1848","A2WLGVXAVT2XTR:3UJ1CZ6IZIX5ZQEJG813U6ZK6GF5SL",1445970350889,"Leo's wife","hll","Leo is an avid golf player.",1,0,0,"test_uncertain",0.63,27592,"English","No.",10,6,233232
"1849","A2WLGVXAVT2XTR:3UJ1CZ6IZIX5ZQEJG813U6ZK6GF5SL",1445970360425,"Leo's wife","hll","From what Hans said we may conclude that the player in question didn't make a hole-in-one on both the first and the second hole.",1,0,0,"xor",1,9535,"English","No.",10,6,233232
"1850","A2WLGVXAVT2XTR:3UJ1CZ6IZIX5ZQEJG813U6ZK6GF5SL",1445970371833,"Harold's pet","lll","Harold's girlfriend didn't want a pet in her house before.",0,0,0,"test_true",1,11407,"English","No.",10,6,233232
"1851","A2WLGVXAVT2XTR:3UJ1CZ6IZIX5ZQEJG813U6ZK6GF5SL",1445970376098,"Harold's pet","lll","It is important for Tom to know whether Harold bought both a cat and a dog.",0,0,0,"rel",0.26,4263,"English","No.",10,6,233232
"1852","A2WLGVXAVT2XTR:3UJ1CZ6IZIX5ZQEJG813U6ZK6GF5SL",1445970385425,"Chloe's holiday","lhh","Chloe recently got back from holidays.",0,1,1,"test_true",0.77,9326,"English","No.",10,6,233232
"1853","A2WLGVXAVT2XTR:3UJ1CZ6IZIX5ZQEJG813U6ZK6GF5SL",1445970401290,"Chloe's holiday","lhh","If Susan brought some extra suntan lotion, it is likely that Amelia brought some as well.",0,1,1,"prior",0.8,15864,"English","No.",10,6,233232
"1854","A2WLGVXAVT2XTR:3UJ1CZ6IZIX5ZQEJG813U6ZK6GF5SL",1445970405273,"Chloe's holiday","lhh","If Amelia brought some extra suntan lotion, it is likely that Susan brought some as well.",0,1,1,"prior",0.76,3982,"English","No.",10,6,233232
"1855","A2XTK2B7R27RBG:38JBBYETQPIMTO5118YO0XPR5TE4EH",1445970924197,"Harold's pet","lll","Harold's girlfriend didn't want a pet in her house before.",0,0,0,"test_true",0.09,25528,"english",NA,9,4,270318
"1856","A2XTK2B7R27RBG:38JBBYETQPIMTO5118YO0XPR5TE4EH",1445970950616,"Harold's pet","lll","From what Richard said we may conclude that Harold did not buy both a cat and a dog.",0,0,0,"xor",0.86,26419,"english",NA,9,4,270318
"1857","A2XTK2B7R27RBG:38JBBYETQPIMTO5118YO0XPR5TE4EH",1445970976979,"Mrs Sanders' son","hhl","Mrs Sanders had pasta for lunch yesterday.",1,1,0,"test_uncertain",0.13,26363,"english",NA,9,4,270318
"1858","A2XTK2B7R27RBG:38JBBYETQPIMTO5118YO0XPR5TE4EH",1445970986578,"Mrs Sanders' son","hhl","It is important for the teacher to know whether Ted had both pizza and pasta.",1,1,0,"rel",0.63,9583,"english",NA,9,4,270318
"1859","A2XTK2B7R27RBG:38JBBYETQPIMTO5118YO0XPR5TE4EH",1445971007320,"Tony's clubbing","lhl","Techno is quite different from Jazz and from Metal.",0,1,0,"test_true",0.92,20742,"english",NA,9,4,270318
"1860","A2XTK2B7R27RBG:38JBBYETQPIMTO5118YO0XPR5TE4EH",1445971017392,"Tony's clubbing","lhl","If they play Metal at the club tonight, it is likely that they also play Jazz.",0,1,0,"prior",0.04,10072,"english",NA,9,4,270318
"1861","A2XTK2B7R27RBG:38JBBYETQPIMTO5118YO0XPR5TE4EH",1445971024270,"Tony's clubbing","lhl","If they play Jazz at the club tonight, it is likely that they also play Metal.",0,1,0,"prior",0.08,6878,"english",NA,9,4,270318
"1862","A2XTK2B7R27RBG:38JBBYETQPIMTO5118YO0XPR5TE4EH",1445971054271,"Carl's party","hll","John did not spend much time outside.",1,0,0,"test_true",0.15,30001,"english",NA,9,4,270318
"1863","A2XTK2B7R27RBG:38JBBYETQPIMTO5118YO0XPR5TE4EH",1445971062866,"Carl's party","hll","John knows whether Carl danced passionately with both Sue and Mary.",1,0,0,"comp",0.64,8593,"english",NA,9,4,270318
"1864","A2XTK2B7R27RBG:38JBBYETQPIMTO5118YO0XPR5TE4EH",1445971083905,"Gigi's exams","hlh","Gigi aspires to a career in science.",1,0,1,"test_uncertain",0.89,21039,"english",NA,9,4,270318
"1865","A2XTK2B7R27RBG:38JBBYETQPIMTO5118YO0XPR5TE4EH",1445971092974,"Gigi's exams","hlh","From what Carrie said we may conclude that Gigi did not pass both her Physics exam and her Chemistry exam.",1,0,1,"xor",0.05,9069,"english",NA,9,4,270318
"1866","A2XTK2B7R27RBG:38JBBYETQPIMTO5118YO0XPR5TE4EH",1445971113540,"Gerald's graduation","llh","Gerald took almost ten years to graduate.",0,0,1,"test_uncertain",0.27,20566,"english",NA,9,4,270318
"1867","A2XTK2B7R27RBG:38JBBYETQPIMTO5118YO0XPR5TE4EH",1445971127577,"Gerald's graduation","llh","It is important for Rick to know whether both Gerald's mother and his father attended the ceremony.",0,0,1,"rel",0.61,14037,"english",NA,9,4,270318
"1868","A2XTK2B7R27RBG:38JBBYETQPIMTO5118YO0XPR5TE4EH",1445971143219,"Mrs Gibbs' worry","hhh","Mrs Gibbs did not accompany her husband when Cindy served him.",1,1,1,"test_true",0.63,15642,"english",NA,9,4,270318
"1869","A2XTK2B7R27RBG:38JBBYETQPIMTO5118YO0XPR5TE4EH",1445971153357,"Mrs Gibbs' worry","hhh","If Mr Gibbs had a beer, it is likely that he also had a steak.",1,1,1,"prior",0.46,10138,"english",NA,9,4,270318
"1870","A2XTK2B7R27RBG:38JBBYETQPIMTO5118YO0XPR5TE4EH",1445971157075,"Mrs Gibbs' worry","hhh","If Mr Gibbs had a steak, it is likely that he also had a beer.",1,1,1,"prior",0.42,3702,"english",NA,9,4,270318
"1871","A2XTK2B7R27RBG:38JBBYETQPIMTO5118YO0XPR5TE4EH",1445971177935,"Chloe's holiday","lhh","Chloe forgot about bringing some beach towels, too.",0,1,1,"test_uncertain",0.28,20860,"english",NA,9,4,270318
"1872","A2XTK2B7R27RBG:38JBBYETQPIMTO5118YO0XPR5TE4EH",1445971194515,"Chloe's holiday","lhh","Chloe knows whether both Susan and Amelia brought some extra suntan lotion.",0,1,1,"comp",1,16564,"english",NA,9,4,270318
"1873","A2YKW761AK4ZGY:30JNVC0ORAS523J1P6D7O3N9T1MHQQ",1445970928588,"Pete's accident","hhl","Pete's teacher saw him fall off the slide.",1,1,0,"test_uncertain",0.49,26621,"english",NA,8,2,301597
"1874","A2YKW761AK4ZGY:30JNVC0ORAS523J1P6D7O3N9T1MHQQ",1445970948768,"Pete's accident","hhl","It is important for Pete's mother to know whether Pete broke both his arm and his leg.",1,1,0,"rel",0.54,20175,"english",NA,8,2,301597
"1875","A2YKW761AK4ZGY:30JNVC0ORAS523J1P6D7O3N9T1MHQQ",1445970972893,"Jimmy's trip","lll","Jimmy went on a school trip to New York City.",0,0,0,"test_false",0.06,24120,"english",NA,8,2,301597
"1876","A2YKW761AK4ZGY:30JNVC0ORAS523J1P6D7O3N9T1MHQQ",1445970995130,"Jimmy's trip","lll","If Jimmy visited the Statue of Liberty, it is likely that he also visited the Empire State Building.",0,0,0,"prior",0.25,22231,"english",NA,8,2,301597
"1877","A2YKW761AK4ZGY:30JNVC0ORAS523J1P6D7O3N9T1MHQQ",1445971001990,"Jimmy's trip","lll","If Jimmy visited the Empire State Building, it is likely that he also visited the Statue of Liberty.",0,0,0,"prior",0.14,6854,"english",NA,8,2,301597
"1878","A2YKW761AK4ZGY:30JNVC0ORAS523J1P6D7O3N9T1MHQQ",1445971024175,"Lily's husband","lhl","Eric has a problem with his liver for which he has to stop drinking alcohol.",0,1,0,"test_uncertain",0.7,22179,"english",NA,8,2,301597
